Id	text	user_location
928	airlangga pak jokowi kata vaksinasi covid ubah main	Jakarta, Indonesia
929	jumlah terima vaksinasi covid hari bulan juli	Jakarta, Indonesia
930	pantau kembang lalu rasa sakit korban tinggal lalu apa tanggung jawab e media kata sakit justru salah korban jujur pribadi pikir banyak media pergi lalu screening vaksin turut kurang akurat jadi total mcu	Jakarta, Indonesia
931	kenal produsen usaha vaksin covid sinovac hingga pfizer	Jakarta, Indonesia
932	airlangga ri suntik juta dosis vaksin covid hingga juli	Jakarta, Indonesia
933	iya betul moga vaksin buah	Jakarta, Indonesia
934	vaksin datang program gotong royong asal sinopharm	Jakarta, Indonesia
935	pernah telusur halaman informasi vaksinasi jakarta mana semua informasi lengkap mulai daftar vaksinasi hingga kece kuota vaksinasi jakarta	Jakarta, Indonesia
936	provinsi kasus aktif tinggi prioritas vaksinasi covid	Jakarta, Indonesia
937	usaha afrika biovac terima bahan vaksin eropa	Jakarta, Indonesia
938	informasi kait ubah jadwal lokasi vaksinasi dosis lihat infografis ikut terima kasih	Jakarta, Indonesia
939	capai vaksinasi covid mataram	Jakarta, Indonesia
940	harap bantu segera bentuk kebal komunal	Jakarta, Indonesia
941	warga yunani gelar demonstrasi vaksin virus corona covid    syntagma square athena aksi tuju program vaksinasi corona	Jakarta, Indonesia
942	jeli	Jakarta, Indonesia
943	anak ayam minta vaksin ayam covid lengkap syarat administrasi cari informasi kesana kemari lokasi buru anak ayam tiba tiba minta vaksin jenis indonesia ayo ikut	Jakarta, Indonesia
944	kalau sembuh covid berapa bulan minum vaksin	Jakarta, Indonesia
945	vaksin sinovax daftar pigimane arab saudi masyarakat indonesia berangkat umrah sini vaksin buat china	Jakarta, Indonesia
946	kena lapor harap kirim lalu email sertifikat beri data nama lengkap tempat lahir tanggal lahir nomor ponsel tempat vaksinasi	Jakarta, Indonesia
947	darurat orang vaksinasi semua minta fotokopi ktp nya lebih alamat beda minta surat terang domisili vaksinasi bukan dasar bantu makan ktp asli cukup benar nik ribet situasi	Jakarta, Indonesia
948	tentara as masuk indonesia sweb china turun sweb kebal memang corona sedang vaksin sinovak fungsi siapa tanggung jawab	Jakarta, Indonesia
949	jumlah kasus covid as hampir tiga kali lipat pekan akhir jadi tengah gempur disinformasi hoaks vaksin	Jakarta, Indonesia
950	iya bilang gitu gilir kamu sertifikat vaksin keluar	Jakarta, Indonesia
951	jawa barat sumbang kasus covid cukup banyak tempat urut cara nasional	Jakarta, Indonesia
952	kemarin vaksin sinovac jadi moga vaksin beri efek buat kulit glowing	Jakarta, Indonesia
953	per hari kamis vaksin covid lengkap baru capai	Jakarta, Indonesia
954	calon tumpang manfaat vaksinasi covid bandara pura ii banyak soetta	Jakarta, Indonesia
955	nomor batch vaksin foto bukti kartu vaksinasi ktp kartu keluarga usia bawah   tahun deskripsi masalah terima kasih	Jakarta, Indonesia
956	menko pmk ingat perintah daerah jangan tumpuk vaksin gudang	Jakarta, Indonesia
957	vaksinasi pintu pintu bin sorot kata	Jakarta, Indonesia
958	wilayah surabaya guys buru vaksin vaksin astrazeneca siapa pertama dapet perhati syarat	Jakarta, Indonesia
959	vaksin covid orang indonesia cek efek samping biasa jadi	Jakarta, Indonesia
960	benar logis gan validasi laku banding ktp asli milik bukan ktp asli fotokopi bagaimana cara kontrol vaksin kali kali lindung websitenya situ jelas id nya daftar	Jakarta, Indonesia
961	hahahaha bayang suntik vaksin tiba tiba jadi tambah cantik kandung skincare vaksin	Jakarta, Indonesia
962	akibat tolak individu vaksin independen salah satu aku bagai ahli epidemiologi	Jakarta, Indonesia
963	dok baru selesai isoma minggu jadwal vaksin bulan agustus langsung ambil vaksin tunggu bulan covid	Jakarta, Indonesia
964	berapa ratus ribu vaksin kosong semua vaksin konfirmasi keluar virus pandemi konfirmasi mutasi cara apa tinggal covid hidup	Jakarta, Malaysia
965	puluh anak karawang kerja antri vaksin imunisasi beri pemkab karawang media sosial nyata sesuai nyata kondisi lapang seman seru pemkab	Jakarta,Indonesia
966	banyak agama dunia tiap orang pikir beda apa agama ajar paham manusia cerdas lihat nilai moral alam cepat vaksin jelas upaya teliti manusia	Jakarta. Bandung. Balikpapan.
967	orang kaya duyun duyun as vaksin tanya bagaimana lari diri bandara bukankah paksa	Jakarta. Indonesia
968	memang benar tulis orang makan berita hoaks pandemi khawatir lebih mau mau tinggal	Jakarta/Indonesia
969	memang benar tulis orang makan berita hoaks pandemi khawatir lebih mau mau tinggal orang sebar hoax vaksin padahal upaya indonesia pulih	Jakarta/Indonesia
970	seo selamat pagi ayo stay at home stay at home dulu keluar rumah stay safe proses tetap jaga jangan lupa vaksin seo moga pandemi segera akhir tonton konser menang	Jakarta_IND  
971	kayak tugas vaksin perlu vaksin ulang ulang rugi wkwkwkwkwk negara anut era genital	Jaksel
972	perintah kabupaten malang sama polres malang kodim batu malang mulai lancar program serang massal masyarakat umum stadion kanjuruhan kepanjen malang minggu	Jalan Kawi 11B, Kota Malang
973	puluh ibu ibu datang mapolres kota senin pagi bukan daftar bagai malah lapor duga gelap tipu modus arisan	Jalan Kawi 11B, Kota Malang
974	meski akhir akhir lonjak kasus tingkat nyata angka okupasi tempat tidur jumlah rumah sakit rujuk mulai turun tetap ikut kembang	Jalan Kawi 11B, Kota Malang
975	pemkab malang sama polres malang kodim batu malang mulai lancar program serang massal masyarakat umum stadion kanjuruhan kepanjen malang minggu	Jalan Kawi 11B, Kota Malang
976	menteri sehat rekomendasi vaksinasi anak anak kota bekas astrazeneca download aplikasi tribunnews update berita baru android	Jalan Palmerah Barat 33-37 Jkt
977	senin hari vaksinasi massal stadion wibawa mukti cikarang sasar masyarakat download aplikasi tribunnews update berita baru android	Jalan Palmerah Barat 33-37 Jkt
978	pil vaksin covid pertama temu israel oravax medical uji klinis vaksin oral alhamdulillah vaksin oral mudah distribusi perlu tenaga sehat khusus	Jalan Palmerah Barat 33-37 Jkt
979	vaksin baik vaksin kurang resiko kena covid covid nyata panik takut tingkat imunitas selalu pikir positif penting masa pandemi tetap manusia manusia orang	Jambee, Indonesia
980	bukan soal kuantitas omg bujuk orang biar vaksin repot banyak orang vietnam bukan	Jambi, Indonesia
981	gimana coba juta orang tinggal jadi korban bajing vaksin sekarang china baru aku sedang rezim wajib semua warga negara china aku vaksin corona efektif berapa khasiat	Jambi, Indonesia
982	kalau hampir mati nunggu obat kalau obat jangan vaksin obat orang sakit jangan biar krisis sendiri jangan biar gerbang bandara masuk bawa virus potensial	Jateng
983	kemarin satpam vaksin sekarang surveyor jangan jenguk tugas antar tabung oksigen mau panggung buka sesuai tugas pokok fungsi tutup perlu evaluasi kalau berani	Jateng selatan
984	kemarin satpam vaksin sekarang jadi surveyor jangan jenguk tugas antar tabung oksigen mau panggung buka sesuai tugas pokok fungsi tutup perlu evaluasi kalau berani	Jateng selatan
985	cara tingkat iman era sekarang cara tingkat imunitas kondisi sekarang maaf vaksin kuat atas	Jatiasih, West Java (Kota)
986	benar demonstrasi hari jakarta bantu pihak wenang bawa gbk kemudian semua orang vaksinasi	Jatinangor sumedang
987	lari paksa orang miskin antivaksin rasa milik hak asasi manusia utama sedang jalan obat sakit dasar	Jawa Barat, Indonesia
988	syarat administrasi laku sekarang laku rilis bulan juni dasar hukum tanya kendala manajemen admin masalah biasa buruk coret coret sana sini	Jawa Barat, Indonesia
989	baru lapor sekarang baru orang vaksin	Jawa Barat, Indonesia
990	makin banyak pasok bahan baku vaksin mk daya tahan kebal masyarakat makin tingkat	Jawa Barat, Indonesia
991	pernah tonton kartun malaysia rtv jelas vaksin aman bahaya benar bantu kebal keluarga tetangga mau vaksin	Jawa Barat, Indonesia
992	beberapa jam vaksin muncul	Jawa Barat, Indonesia
993	omg mau vaksin moga jelek	Jawa Barat, Indonesia
994	ngurus birokrasi perlu fotokopi percaya vaksin kandung chip bluetooth	Jawa Pusat
995	maklum second wes kalau korang durung sido vaksin tau	Jawa Tengah
996	kasus positif banyak makan hoax apa vaksin sehat perlu vaksin kata bidan heboh	Jawa Tengah
997	sangat lucu vaksin	Jawa Tengah
998	kawan kawan kalau burahman desa kunci sangat keras desa ppl sulit kendali bahkan pakai topeng suruh vaksinasi gadateng datang malah desa tetangga gilir bansos orang barbar rebut	Jawa Tengah
999	kapan vaksin aku rindu belai bulu kaki	Jawa Tengah, Indonesia
1000	mau share buat driver ojol vaksin covid syarat retweet reply tweet foto vaksin kemarin jelas sedikit kalau menang mau pakai apa sekarang menang	Jawa Tengah, Indonesia
1001	alhamdulillah habis vaksin beli pulsa lalu bungkus swadaya biar lebih hemat	Jawa Tengah, Indonesia
1002	nyata bukan makan cepat saji orientasi amerika konsumsi hoax hoax vaksinasi buat kasus corona paman sam lonjak	Jawa Tengah, Indonesia
1003	bismillah hari mau vaksin	Jawa Tengah, Indonesia
1004	jaga hubung baik china as bukan salah china mutasi genetik varian delta baru antibiotik terus kembang jadi spektrum luas atas bagai jenis mutasi genetik bakteri pacu waktu habis waktu vaksin sinovac booster sinopharm baru	Jawa Tengah, Indonesia
1005	mau share buat driver ojol vaksin covid syarat retweet reply tweet foto vaksin kemarin jelas sedikit kalau menang mau pakai apa sekarang menang k menang tutup besok pkl	Jawa Tengah, Indonesia
1006	buru puji minta bantu ringan kerja segera vaksin patuh ppkm darurat patuh program m rang hoaks covid bantu tenaga sehat saling bantu bantu indonesia lawan pandemi cepat pulih indonesia	Jawa Tengah, Indonesia
1007	jawa barat lurah mranggen jawa tengah jumat kemarin anak mau vaksin jadwal tiba lokasi nyata vaksin hbs nya minggu lalu gubernur teriak ayo vaksin	Jawa Tengah, Indonesia
1008	alhamdulillah habis vaksin buat beli pulsa lalu bungkus swadaya biar lebih hemat	Jawa Tengah, Indonesia
1009	semarang regency vaccine min info	Jawa Tengah, Indonesia
1010	jangan laku vaksinasi tubuh fit sedang sakit jangan laku vaksinasi milik sakit derita rekomendasi layak vaksin dokter jangan paksa diri gegabah orang salah bahkan mau turut	Jawa Timur
1011	tanya dokter milik diagnosis neuropati derita diabetes terapi medis laku dokter	Jawa Timur
1012	asal mau vaksin esemka barang ajaib	Jawa Timur, Indonesia
1013	bagaimana	Jawa Timur, Indonesia
1014	surat vaksin jadi periksa lindung	Jawa Timur, Indonesia
1015	min mau tanya vaksin minggu sekarang muncul sertifikat mohon solusi pihak kelola terima kasih	Jawa Timur, Indonesia
1016	beberapa harga upacara cb buat harga area tingkat tes tinggi akurasi data sesuai area cakup vaksin tinggi misal bukan harga jadi zona hijau	Jawa Timur, Indonesia
1017	mau vaksin lupa bawa fotokopi ktp padahal tempat fotokopi jauh tunjuk hidup sederhana rumit interpretasi hadap fotokopi ktp	Jawa Timur, Indonesia
1018	vaksin sulit	Jawa Timur, Indonesia
1019	turut vaksin hidup keluarga minum jamu jokowi cukup	Jawa Timur, Indonesia
1020	hai moots mau nanya dong kalau perut kamu enak trus kadang sakit perut sahabat wkwkwk kalau mau vaksin lebih baik nunggu sembuh vaksin	Jawa barat 
1021	harap masalah waktu berita muncul vaksin bayar kw gratis hilang edar	Jawa tengah
1022	moga cepat sembuh vaksin	Jayapura , papua
1023	mimpi mau vaksin dekat punggung telapak tangan mau masuk air sama dok jangan share main bacok	Jaybee
1024	turut penuh syarat tolak vaksin sopan	Jejeran,Bantul 
1025	repot urus surat hilang surabaya syarat vaksin wajib tempat vaksin sedia	Jekardah
1026	apa apa bahkan pergi gym baik sehat satu hari vaksin kemudian efek injeksi selesai satu hari pergi gym salah	Jember, Jawa Timur
1027	apa apa bahkan pergi gym baik sehat satu hari vaksin kemudian efek injeksi selesai satu hari pergi gym salah gan	Jember, Jawa Timur
1028	jadi zombie vaksin pusing mual akhir	Jember, Jawa Timur
1029	perintah lalu panjang ppkm darurat bareng giat t testing tracing treatment laku tular peta baik utama cepat vaksinasi bukan	Jember, Jawa Timur
1030	ibu daftar vaksin ikut vaksinasi duduk tempat masuk huni rumah suka	Jepara, Jakarta, Indonesia
1031	dengar dengar x dosis vaksin benar baru mati tanggung jawab	Jkt city
1032	herd immunity yogyakarta target vaksin covid per hari lalu	Jl Jend Sudirman 52 Yogyakarta
1033	kadivpa pantau laksana vaksinasi lengkap rutan cipinang	Jl. Bekasi Timur Raya No.170 C
1034	hari kamis juli pukul       gd smp bpp jl kartini kebon banana kel no kabupaten bandung kota bandung giat booth vaksinasi presisi kota bandung rangka layan sehat bhayangkara negara	Jl. Merdeka 18-20 Bdg 40117
1035	giat vaksin gotong royong pt marktel langsung pt marktel jl sanggar kencana xxiii no kel jatisari camat buah batu kota bandung vaksinasi banyak ratus orang jenis vaksin corona vac sinovac multidose banyak vial	Jl. Merdeka 18-20 Bdg 40117
1036	stan vaksin tepat polri andir rangka bhayangkara health service negara giat sebut laksana rangka transformasi tepat dukung cepat tangan covid masyarakat sehat pulih ekonomi nasional tuju indonesia maju	Jl. Merdeka 18-20 Bdg 40117
1037	laksana vaksin upt puskesmas cibuntu tahap banyak vaksin usia atas tiga bangsal warung muncangcaringin cibuntu aktif rangka cepat vaksinasi masyarakat	Jl. Merdeka 18-20 Bdg 40117
1038	giat gotong royong vaksin telkomsel gedung telkomsel jl soekarno hatta no kel jatisari kec buah batu kota bandung target jumlah orang vaksinasi tiga ratus orang vaksinasi anut m t prokes	Jl. Merdeka 18-20 Bdg 40117
1039	halo sobat sma situasi pandemi covid sma semarang usaha beri lindung optimal teman sma vaksinasi covid sobat sma ikut vaksinasi covid sobat sma lindung indonesia maju	Jl. Pemuda No. 143 Semarang
1040	sma negeri semarang siap vaksin ptm yuk ikut vaksinasi covid hari senin juli sahabat kecil lindung pt sma great indonesia siap maju jadi riah giat link twibbonnya	Jl. Pemuda No. 143 Semarang
1041	masuk kota palu tunjuk kartu vaksin tes antigen negatif	Jl. Tg Dako 17 Palu
1042	kejar target herd immunity pemkab cepat vaksinasi	Jln. Ahmad Yani No. 110 Subang
1043	mau vaksin positif dulu	Jogja
1044	birokrasi indonesia milik kampanye vaksin sangat kuat sistem birokrasi jijik	Jogja | Indonesia
1045	vaksin cukup jangan ajak semua prioritas cara tahap banyak orang tahu daftar vaksin tahu buat apa salah	Jogja | Indonesia
1046	pak vaksin kalau penting banget undang sistem daftar buru buru jatah jatah kalau vaksin salah kalau susah vaksin jangan nyampe program vaksin tutup banyak orang takut akhir bayar vaksin vaksinasi	Jogja | Indonesia
1047	hayoo d ki aq jan ledak erti hati hati kwi nasional lag e le masuk uji pintar noh up penuh syarat kerja orang asing ha san kerja bagai boneka kata vaksin voksan kerucut desak ubah mana nasaqan	Jogja | Indonesia
1048	sistem buat kalau milu pakai undang jadi jelas semua warga tahu vaksin mau akhir akhir sama kalau milu mau pilih mau pilih mau vaksinasi jangan coba coba cepat kampanye	Jogja | Indonesia
1049	vaksinasi ndx indonesia program ono ora min e bagus golek rai lebih baik sebar puskesmas per desa dadi tumpuk orang banyak	Jogja-surabaya
1050	lihat cakup vaksin kalteng populasi minat vaksin tinggi vaksin sedia mungkin provinsi hitam merah lebih suka kira	Jogjakarta
1051	moga vaksin rata luar jawa sini kuota tempat per periode bu tunda	Jogjakarta
1052	iya mba keluar masuk kalimantan tengah wajib pcr vaksin pdhl vaksin e ready	Jogjakarta
1053	pukpuk aku mau vaksin hari iniyyy	Jogjakarta, Indonesia
1054	proses jaga pakai masker hindar ramai buru vaksin	Jombang, Indonesia
1055	tanya puskesmas dekat jadwal rutin vaksinasi	Jombang, Indonesia
1056	proses jaga masker pakai hindar ramai buru vaksin	Jombang, Indonesia
1057	polres bangka gelar stand vaksin presisi mabes polri polres bangka sela sela laksana vaksinasi dosis masyarakat umum	KABUPATEN BANGKA TENGAH
1058	tahap koordinasi insya allah mulai juli mohon doa siap jalan lancar tunggu kirim vaksin menteri sehat	Kab. Sukoharjo
1059	bismillah dulu gan kalau mau vaksin biar jos sembuh dulu	Kabupaten Bandung 
1060	mati empati hati nurani masalah vaksin bayar rektor ui hasil redam kuat netizen moga masalah segera ungkap	Kabupaten Bekasi - Jawa Barat 
1061	update situasi kasus covid vaksinasi covid kabupaten kukar juli lengkap dinas sehat kabupaten kuta kartanegara	Kabupaten Kutai Kartanegara
1062	kate e kalau puskesmas prioritas vaksin	Kalimantan Barat, Indonesia
1063	layan pusat vaksinasi permanen bandara pura ii kagum	Kalimantan Barat, Indonesia
1064	vaksinasi cegah sebar covid	Kalimantan Barat, Indonesia
1065	mau vaksin jadi bangun siang	Kalimantan Barat, Indonesia
1066	vaksinasi cegah tular covid	Kalimantan Barat, Indonesia
1067	benar gan kemarin vaksin isi nik hapal nik jadi lancar	Kalimantan Barat, Indonesia
1068	orang orang sambut vaksinasi terap m terap	Kalimantan Barat, Indonesia
1069	tips tingkat imunitas jam tidur cukup makan atur gizi imbang olahraga penuh vit d c kelola stres banyak minum makan buah sayur ikan vaksin banyak doa baik ibadah banyak sedekah	Kalimantan Barat, Indonesia
1070	ikut tahap vaksin juli lalu ppn mangkat undang ikut vaksin kantor ppn mangkat kamis juli mulai pkl wib jangan lupa bawa ktp kartu vaksin	Kalimantan Barat, Indonesia
1071	atas pandemi vaksinasi	Kalimantan Barat, Indonesia
1072	wal informasi vaksin pertama png redup	Kalimantan Selatan, Indonesia
1073	kalaupun luar bjm kalau tunjuk surat vaksin lewat	Kalimantan Selatan, Indonesia
1074	informasi lokasi vaksin waktu pang wal	Kalimantan Selatan, Indonesia
1075	vaksin tiga	Kalimantan Selatan, Indonesia
1076	lalu tinggal kdd kartu vaksin kada kawa lewat pos blokir	Kalimantan Selatan, Indonesia
1077	padahal betakun ulun vaksin sertifikat ulun akses sertifikat jadi kalau lewat isolasi kasih surat vaksin tya	Kalimantan Selatan, Indonesia
1078	informasi mana dapetin vaksin	Kalimantan Selatan, Indonesia
1079	kapolres kalteng tinjau vaksinasi desa panarung palangka raya	Kalimantan Tengah, Indonesia
1080	kalau informasi ss atas terjemah hangeul terjemah sama tulis gdp rendah vaksinasi rendah populasi infeksi covid gdp per orang tingkat vaksinasi virus corona fyi bukan arti beda	Kalimantan Timur, Indonesia
1081	info vaksin samarinda usia    tahun mana tembok rata rata puskesmas prioritas lansia	Kalimantan Timur, Indonesia
1082	info vaksin samarinda usia    tahun mana tembok rata rata puskesmas utama lansia	Kalimantan Timur, Indonesia
1083	ajar sejarah pandemi nyata bukan konspirasi vaksinasi atas postingan lama upload marak berita konspirasi olah pandemi nyata banyak tolak program vaksinasi masuk tokoh masyarakat pengaruh	Kalimantan Timur, Indonesia
1084	brita opo oooh senang vaksin segera brita buat orang pikir x vaksin aneh	Kalimantan Timur, Indonesia
1085	tolak lupa kata covid bahaya sembuh sendiri kok buat vaksin nusantara buat apa vaksin orang rebut vaksin bahas cara detail	Kalimantan Timur, Indonesia
1086	vaknus bagai vaksin cegah covid lolos uji klinis prosedur ilmiah langgar teori dasar benar	Kalimantan Timur, Indonesia
1087	vaknus bagai vaksin cegah covid lewat uji klinis prosedur ilmiah langgar teori dasar benar	Kalimantan Timur, Indonesia
1088	tuju coba cek mana vaksin covid distribusi dinas sehat provinsi kabupaten	Kaltim
1089	kodim hss serang vaksin covid remaja	Kandangan, Indonesia
1090	serius tanya dokter sebar vaksin palsu bukan langgar sumpah dokter malah cabut gelar malah sulit masyarakat umum	Karanganyar,  Jawa tengah
1091	informasi polisi beda atur ppkm mikro pusat belanja mall pusat dagang sosialisasi vaksin keliling	Karanganyar, Indonesia
1092	dok mau tanya hbs gejala covid ringan langsung vaksin sesuai jadwal beda selesai isolasi baru minggu terima kasih	Karanganyar, Indonesia
1093	hoax edar fb jumlah vaksin moderna amerika kurang indonesia fakta vaksin kirim thp juta dosis juli jt juli total juta dosis	Karanganyar, Indonesia
1094	nah teh pribadi tuju surket vaksin benar benar gaya komunis	Karawang, Jawa Barat
1095	pagi pagi orang bikin hoax paksa vaksin usaha vaksin tangkup kata biar vaksin keluar ah otak cetek	Karawang, Jawa Barat
1096	semua umur vaksinasi laku x efektif cegah covid gejala arti positif lebih banyak papar orang asimptomatik tunjuk gejala apa terima kasih sedia vaksinasi	Kebayoran Baru, Indonesia
1097	vaksinasi hari kota makassar	Kebon Jeruk, Jakarta
1098	sama vaksin btw	Kebumen 
1099	mau proses cari vaksin a z tiap kali signature hilang m	Kebumen, Indonesia
1100	jadi kalau suka arti baca berita mohon cerah beli vaksin merk lebih murah sesuai rekomendasi who cc	Kebumen-Cirebon-Jakarta-Batam
1101	senin kepala binmas aiptu heri pantau laksana tahap vaksinasi puskesmas wah	Kecamatan Welahan
1102	rabu kapolres wah akp susiyanto sama anggota laku pantau laksana vaksinasi pabrik nikki super wah	Kecamatan Welahan
1103	lama juli target vaksinasi tiga puluh ribu orang tiap hari puluh ribu hari hari vaksinasi giat selenggara ojk industri jasa uang se jawa timur grand city surabaya	Kediri, Jawa Timur
1104	jelas vaksin sinovac astrazeneca ustadz adi hidayat lc ma bimbang vaksin silah simak	Kediri, Jawa Timur
1105	turut vaksin sulit malas buat daftar misal terlalu malas daftar	Kemiri, Indonesia
1106	semarang gol a vaksinasi anak laki laki	Kendal, Indonesia
1107	vaksin kerja	Kendari, Indonesia
1108	ngantuk awal vaksin lapar lalu hari lahir makan kemudian	Kendari, Indonesia
1109	waspada hadap provokasi gera giring opini hadap bijak perintah pro islam umat islam vaksin haram ppkm bunuh orang	Khuntien
1110	wah temu pak tahu rekan kantor sistem zonasi pulau provinsi vaksin provinsi tempat tinggal	Khuntien
1111	min daftar vaksin mungkin	Klaten Tengah, Indonesia
1112	vaksin sinovac waktu bulan antibodi turun laku vaksin lanjut bayang berapa untung china pandemi langsung lama	Klaten Utara, Indonesia
1113	klaten simpul bila vaksin tingkat desa min	Klaten, Jawa Tengah
1114	sok bikin regulasi padahal negara baru beri vaksin seluruh duduk	Klaten, Jawa Tengah
1115	jogja alert vaksin masal jec umum kapan agustus tinggal daftar terus datang langsung jec kuota banyak bantu share gan	Klaten,Central Java,Indonesia
1116	vaksinasi rupa salah satu upaya cepat pulih pandemi covid    menteri koperasi koperasi sama jumlah menteri gelar vaksinasi center gedung sebut sejak juni lalu	Kota Banda Aceh, Nangro Aceh D
1117	stok vaksin covid tip aceh puskesmas mulai kosong	Kota Banda Aceh, Nangro Aceh D
1118	jalan jalan as vaksin covid populer kalang masyarakat indonesia tarif mulai rp juta hingga new york apa	Kota Bandung
1119	sekali positif vaksin tetap vaksin ideal tunggu antibodi kurang atur tunda bulan bulan sembuh praktis sempat langsung vaksinasi manfaat tingkat titer antibodi antibodi baru	Kota Bandung, Jawa Barat
1120	laksana vaksinasi laku terus terus tiap kantor lurah arti kurang mobilitas warga atur tiap hari per rw	Kota Bandung, Jawa Barat
1121	eropa umum vaksin covid anak anak spikevax	Kota Bandung, Jawa Barat
1122	memang benar vaksin pertama enak sama sekali tahu apa apa	Kota Bandung, Jawa Barat
1123	pesan vaksin kata daftar vaksin x gagal daftar semua stok banyak jkt	Kota Bandung, Jawa Barat
1124	main sawah main impor laut impor garam main daerah bencana bantu lip service belakang apotik siap import obat vaksin siap import jaga apotek	Kota Bandung, Jawa Barat
1125	mau mana syarat vaksin cari vaksin sana sini kata selesai ribet banget tinggal wakanda coba indonesia bakal begini	Kota Bandung, Jawa Barat
1126	mau mana syarat vaksin cari vaksin sana sini kata tamat ribet banget tinggal wakanda coba indonesia jadi begini	Kota Bandung, Jawa Barat
1127	kena covid gejala ringan dok isoman hari kira kalau mau vaksin nunggu berapa lama	Kota Bandung, Jawa Barat
1128	bagaimana vaksin hari hahaha mana kurang tidur jam	Kota Bandung, Jawa Barat
1129	main sawah main impor laut impor garam main daerah bencana bantu lip service akhir akhir apotik siap impor obat vaksin siap impor jaga apotek	Kota Bandung, Jawa Barat
1130	tenang tahun lalu new normal kata vaksin door to door laku cepat lebih tetap kuat imun vaksin kebal kelompok suka lupa cakap sendiri	Kota Batam, Kepulauan Riau
1131	selamat pagi minta link daftar vaksin pulau riau kota batam terima kasih	Kota Batam, Kepulauan Riau
1132	kakak vaksinasi	Kota Baubau, Sulawesi Tenggara
1133	figc harap main liga italia vaksin covid tanding mau konsekuensi	Kota Bekasi
1134	sayang jenis vaksin khusus umum mungkin harga lebih mahal	Kota Bekasi
1135	pak ppkm henti turut lebih efektif efisien ganti ketat vaksin jalan protokol sehat kendali laku semua tugas level perlu tim khusus keluar uang salam sehat bugar bravo nkri	Kota Bekasi
1136	pak ppkm henti lebih efektif efisien ganti ketat vaksin jalan protokol sehat kontrol laku semua jabat hingga perlu tim khusus keluar uang salam sehat bugar bravo nkri	Kota Bekasi
1137	polres bintan operasi stan vaksinasi keliling siswa smp bintan	Kota Bengkulu, Bengkulu
1138	juli sama muncul informasi a siap vaksin tahu kapan informasi ubah	Kota Depok, Jawa Barat
1139	juli sekarang sertifikat muncul nyata a siap d vaksin ext d telepon cek data sana bilang a diinput data a pihak selenggara	Kota Depok, Jawa Barat
1140	dukung pimpin muhammadiyah gorontalo cepat vaksinasi door to door siswa	Kota Gorontalo, Gorontalo
1141	baik tertawa jenak minggu pagi cerah moga suasana hati hibur tingkat imunitas hadap covid tetap disiplin masyarakat terus tingkat vaksinasi t	Kota Jogja,DIY,Indonesia
1142	tanya vaksin obat covid sulawesi tenggara kepala dinas sehat sultra mau ketemu buru mampir	Kota Kendari, Sulawesi Tenggar
1143	tangan suntik suntik asa perih hari kalau minum air kelapa tahu vaksin sarap pagi	Kota Kendari, Sulawesi Tenggar
1144	kalau riset klinis vaksin negeri riset publik swasta turut mas bud tarik cari investor uji klinis vaknus ivermectin mas bud mungkin kerjasama pt harsen	Kota Makassar
1145	kalla idi makassar program vaksinasi gratis free	Kota Makassar
