Id	text	user_location
476	sabtu juli s d wib bripka slamet s h as bhabinkamtibmas sama babinsa ds delanggu laksana tugas aman awas kantor ds delanggu kabupaten delanggu rangka injeksi vaksin covid sinovac lansia	Delanggu, Indonesia
477	vaksin mahasiswa ppkm indonesia sehat	Deli Serdang, Sumatera Utara
478	vaksin ppkm indonesia sehat	Deli Serdang, Sumatera Utara
479	banser kader banser denwatser riau ikut giat vaksinasi pusat vaksin rs polri bhayangkara riau moga selalu beri sehat kuat abdi negara cinta amin	Demak Jateng
480	bagus negara vaksin kartu hilang mau ngurus ktp punya sertifikat vaksin pake sertifikat toefl	Demak, Indonesia
481	kak habis vaksin demam seluruh badan sakit malam demam sembuh hari malah masuk angin hilang indra cium asa sekarang badan fit hampir minggu	Denpasar - Bali
482	tuju yakin virus sekarang vaksin suntik dulu uang paksa orang sakit dicovid sekarang murni vaksin obat keras	Denpasar - Bali
483	betul dok ganti vaksin	Denpasar - Bali
484	kapan selesai studi china antibodi vaksin sinovac tahan bulan a	Denpasar - Bali
485	rasa kak hari tiga vaksin langsung drop paksa kerja tiap hari akhir langsung anosmia hilang indra asa	Denpasar - Bali
486	mungkin menteri hubung keluar atur syarat naik kereta bus vaksinasi syarat kelola krs kampus saudara tunjuk sertifikat vaksinasi apa apa laku	Denpasar - Jakarta, Indonesia
487	kadrun kadrun tahu ppkm suruh demo bawa senjata molotov ngomong kasar siapa sopan btw saudi kasih bantu vaksin kok mana mana	Denpasar Selatan, Indonesia
488	soal vaksin kandung virus silah googling biar lebih tau	Denpasar Selatan, Indonesia
489	bagaimana anti vaksin	Denpasar Selatan, Indonesia
490	terus kirim rumah sakit jiwa minta ktp surat vaksin antar mobil gila semua	Denpasar Timur, Indonesia
491	sini rasa heran heran	Denpasar Timur, Indonesia
492	kalau dukung vaksin negeri mau pro impor luar negeri lebih baik	Denpasar Timur, Indonesia
493	sinergi bank indonesia mang penting dorong cepat vaksinasi covid provinsi bal	Denpasar, Bali
494	hari giat vaksin covid tahap i laksana siswa smk wira bhakti denpasar puskesmas denpasar utara	Denpasar, Bali
495	tolak lupa kata covid bahaya sembuh sendiri kok buat vaksin nusantara buat apa vaksin orang rebut vaksin bahas detail	Denpasar, Bali
496	vaksinasi batubulan cipta herd immunity	Denpasar, Bali
497	warga jaring razia vaksinasi covid jembrana	Denpasar, Bali
498	tadi malam bu bain bilang nasi uang habis kamu lambat jadi pahlawan henti cibir konspirasi patuh prokes henti sebar hoax vaksin pffttt	Denpasar, Bali
499	vaksinasi sabtu vaksinasi	Denpasar, Bali, Indonesia
500	alam sendiri vaksin lengkap tengah juni suami kena covid alhamdulillah gejala ringan suami vaksin gejala lebih banyak jamin kena covid reda gejala iritasi	Denpasar-Bali
501	nah nyata pesan mati vaksin sesuai pesan sesuai	Depok
502	jadi suruh bohong keluar surat layak vaksin alas vaksin kosong mana pulang padahal tempat vaksinasi jalan hati hati sana banyak teman dokter sekarang	Depok
503	ql center gelar vaksin massal sasar warga depok	Depok
504	vaksin jogja	Depok
505	liat aja siapa sangka vaksin bakal dimasukin chip ktp fotokopi gimana mau masukin chip vaksin coba aja lol	Depok
506	politisasi perang proksi vaksin tangan mamarika	Depok
507	asal tahu lebih baik konsultasi dokter tempat biasa obat sakit sebut skrining vaksin kata lebih paham	Depok
508	buat teman teman jogja vaksin yuk buru vaksin hari	Depok - Bandung
509	tiap waktu asa vaksin hari jumat ulang ulang	Depok - Lombok
510	banyak orang asosiasi sinovac lonjak kasus covid hari hari lonjak kasus buat ratus tenaga sehat jangkit covid meski vaksin bagaimana benar jadi	Depok - West Java
511	vaksin antuk lapar	Depok, Indonesia
512	halo min ibu besok jadwal vaksin lansia akhir syarat pergi umroh depan tuju stasiun tangeramg nambo kereta api	Depok, Indonesia
513	bagai kerja sektor esensial tinggal cibinong milik ktp depok bukan milik kendara plat f hari langsung bingung mau vaksin jkt wkwkwkwkwk	Depok, Indonesia
514	asyik vaksin langsung renang renang	Depok, Jawa Barat
515	arti apa ibu kata atas negara langsung laku stok vaksin negara milik vaksin banyak sedang sedikit jadi kena tunda vaksin dulu kebal	Depok, Jawa Barat
516	kalau presiden lengser wakil naik sesuai konstitusi kalau presiden cabut sistem politik hancur jadi pandemi lebih baik benah minta vaksinasi vaksinasi butuh bantu kemudian lapor data	Depok, Jawa Barat
517	perlu terlalu malas jatuh jokowi cara politik mungkin jadi dukung jokowi perlu tanggap terlalu banyak sarkasme percaya jokowi kubu sama bodoh curah energi fokus pandemi vaksinasi bantu sosial insentif tugas sehat	Depok, Jawa Barat
518	paling khawatir daerah tes pcr nya minim kapasitas fasilitas sehat batas kapasitas fiskal daerah rendah literasi warga kait covid moga vaksinasi daerah cepat harap	Depok, Jawa Barat
519	vaksin asekkkk akhir agustus moga pfizer	Depok, Jawa Barat
520	banget upload ktp buat registrasi kalau takut pinjam verifikasi muka hidung baru kemarin vaksin	Depok, Jawa Barat
521	jangan makan hoax covidiot vaksin memang buat bebas ancam virus covid vaksin kurang resiko berat badan mati akibat serang virus covid jadi jangan tunda segera vaksin baik semua	Depok, Jawa Barat
522	merinding baru naik kereta tunjuk huruf rw huruf vaksin	Depok, Jawa Barat
523	pak vaksin sulit batas zonasi ktp kalau cocok camat tempat vaksin terima tempuh jalan ratus kilometer vaksin tolak ktp bagaimana cepat buat herd immunity pak mohon bantu	Depok, Jawa Barat
524	hadap pandemi perintah atur regulasi beri bansos beri vaksin masyarakat patuh anjur perintah politis tokoh agama tokoh masyarakat menghimbau massa rakyat patuh patuh prokes	Desa Hutan Totokarto,Indonesia
525	suluh siap jadi duta kampanye sehat vaksinasi	Desa Pucangro, Kalitengah, Lam
526	walaupun stok vaksin tumpuk booonggg	Di Jl. Juanda, Dago, Bandung
527	selamat pagi sahabat twiips mana kalian jaga imunitas tetap sehat tetap patuh prosedur vaksinasi perlu vaksinasi segera mungkin kebal dengar gera lepas masker tangan	Dobo,Maluku Indonesia
528	vaksin nusantara puji awan kini ban pakar biomolekuler australia	East Batavia
529	menit cek vaksin proteksi masuk daftar vaksin kok sore download sertifikat	East Borneo
530	jogja kasih kopi gratis buat vaksin smr ikut	East Borneo, INA
531	samarinda tempat vaksin glot	East Borneo, Indonesia
532	jangan habis dosis vaksin	East Borneo, Indonesia
533	launching laku gubernur rektor pasien isoman laku konsultasi obat gratis klik universitas mulawarman daftar vaksin lalu website	East Borneo, Indonesia
534	vaksin arroyyan nadia wowkwow baru daftar pak larso	East Jakarta
535	persetan	East Jakarta, Indonesia
536	saran minta maaf tobat lama urus hukum rumit gus nadir saran gus najih minta maaf atas hoaks vaksinasi covid via	East Java
537	baik informasi dokter jaga sehat sedang tugas lapang tanya riwayat sehat calon terima vaksin vaksin fit vaksin istirahat jangan tembak target pak	East Java
538	saran minta maaf tobat lama urus hukum rumit gus nadir saran gus najih minta maaf tipu vaksinasi covid	East Java
539	baik memberitahukan dokter sehat sedang tugas lapang tanya kondisi tubuh riwayat sehat calon vaksin fit vaksin istirahat jangan tembak sasar tuju	East Java
540	kok bau produk negeri buat perintah punya nama bagus brand image bagus bayang laptop merah putih vaksin nusantara rasa belanja zaman majapahit	East Java, Indonesia
541	negara sedang juang atas covid jangan parah narasi provokasi cegah vaksinasi	East Java, Indonesia
542	forkopimda jatim cek vaksinasi jombang realisasi memo herd immunity surabaya	East Java, Indonesia
543	besok jadwal vaksin rumah sakit cukup jauh rumah bingung pergi sendiri minta antar ayah vaksin pertama langsung tidur kurang percaya diri suruh bawa kendara sendiri pergi kerja	East Java, Indonesia
544	benar vaksin rugi individu milik sakit bawa desa orang tinggal vaksin	East Java, Indonesia
545	pertama kali mau vaksin perang dulu	East Java, Indonesia
546	bos mau vaksin alhamdulillah kalau mudah jgn sulit birokrasi	East Java, Indonesia
547	update kembang vaksinasi covid indonesia per juli wib	East Java, Indonesia
548	program vaksin riset terus laku berapa jumlah korban timbul sungguh ironi seluruh negeri	East Java, Indonesia
549	sama hari kasus kemudian hari keluar positif swab pcr lalu langsung minta vaksin bingung benar benar minta vaksin swab pcr benar cukup jengkel akhir erti	East Java, Indonesia
550	sayang sekali vaksin	East Java, Indonesia
551	min tertib daerah administrasi mau vaksin hilang layan mau bikin ktp sertifikat vaksin lingkar setan min kapan pandemi akhir	East Java, Indonesia
552	sini antri konser sini antri vaksin ingat gaaaaaaaaaaa	East Java, Indonesia
553	pemkab madiun mulai vaksinasi covid anak hari anak	East Java, Indonesia
554	pagi baca lebai jual obat minyak urut pagi lebai mau marah dah harap dah nyata darurat pkp sop vaksin kasus pound naik jgn turun hanggok pnipu perintah buta	East Malaysia
555	indra gabung tim jenner institute pimpin profesor sarah gilbert ilmuwan standing ovation tanding buka wimbledon	East Nusa Tenggara, Indonesia
556	kupang semua layan administrasi layan tunjuk kartu vaksin padahal sedia vaksin jumlah tenaga sehat imbang jumlah orang	East Nusa Tenggara, Indonesia
557	dok kemarin dr cicalengka mau bandung pakai krd pintu masuk stasiun minta hasil swab antigen pcr sertifikat vaksin pergi bandung vaksinasi	Garut, Indonesia
558	sertifikat vaksin nga afa pakai swab pcr ant gen	Garut, Indonesia
559	fotokopi kunci bawa ktp asli kalau fotokopi sah kalau negara percaya vaksin pasang microchip	Garut, Indonesia
560	jadi inget jargon cijerah smart city mau masuk pasar pola scan dulu vaksin masuk pasar tweet tahun	Garut, Indonesia
561	perlu vaksinasi	Garut-Bdg-Parigi Jawa Barat
562	sivitas vaksin tumpah efek samping rasa vaksin	Gd. Rektorat Unpad, Jatinangor
563	pergi kantor pagi hari kemarin kerja hari vaksin	Gianyar, Bali
564	hmmm punya vaksin sinovac kemarin pergi planet namek	Gianyar, Indonesia
565	informasi vaksin ndoro kebumen minim informasi ndoro hari jalan gombong kebumen hasil stok vaksin kosong mohon bantu ekstrak informasi vaksin	Gombong, Indonesia
566	kalau takut jangan vaksin kuota vaksin buang percuma orang kaya rich	Gresik
567	vaksin gresik bingung semua arah web padahal web down	Gresik, Indonesia
568	singapura as uni eropa mulai alih fokus vaksinasi temu obat covid	Gresik, Indonesia
569	ayo dukung vaksin nusantara isi survey singkat link bawah pandemi segera akhir terima kasih	Gresik, Indonesia
570	diam ruang publik asai kotak suara a arief ratna sarumpaet tampar zona berangkat haji h dana hassan jemaah haji r ramli logo pki topi h nurwahid vaksin covid ichsannurdin milik	Gresik, Indonesia
571	penting vaksinasi betapa penting vaksin tubuh vaksin salah satu cara paling penting efektif cegah sakit jaga kondisi tubuh	Gresik, Indonesia
572	pihak swasta kerja sama vaksinasi masyarakat indonesia sumbang semua vaksin sinopharm layan gratis semua orang bukan karyawan bayar usaha	Gresik, Indonesia
573	tingkat cakup vaksinasi bukti mampu turun angka mati inggris walaupun jadi lonjak kasus ayo vaksin segera usaha vaksinasi mati tinggi indonesia cakup vaksinasi rendah	Gresik, Indonesia
574	ppkm anggar ratus triliun rupiah uang mana utang beli vaksin ratus triliun utang habis anggar korupsi sekarang jokowi tahu kritik masuk sosmed nya pake admin setir planga plongo	Gresik, Jawa Timur
575	vaksinasi vaksin tingkat sistem kebal sistem kebal hati	Gresik, Jawa Timur
576	anies klaim juta warga dki jakarta milik tahap vaksin covid	Gunung Putri, Indonesia
577	bismillah upaya terus laku bagai daerah mui bpom beri jamin upaya sebut kemudian tawakal allah pks partai politik pertama vaksinasi kota tangerang selatan	Gunung Putri, Indonesia
578	imunisasi massal gabung jadi satu acara tambaksari vaksin tiap desa lihat apa jadi tambaksari sekarang luar stadion kerumun biasa ppkm apa kabar	Gunung Putri, Indonesia
579	sabah byk daerah cnie jabat kesihatan dekat program outreach daftar vaksin vaksin dtg orang sbb jauh perlu dtg ppv so jgn kata sabah xda perlu handpon bukan smart pon	Gunung kinabalu
580	hampir vaksin perlu marah darah naik	Gunungkidul, Yogyakarta.
581	innalilahi wa innalillahi rajion tenkes tinggal covid dokter sendiri kecil selalu mendiagnosa sakit beri obat akhir kali temu bawa laku giat vaksinasi cirebon paviliun bupati	Indonesia 
582	baca komentar komennya nyata masalah vaksin sekarang kayak item step by step	Indonesia . Bengkulu
583	bagaimana cara kerja vaksin covid tubuh anak anak orang dewasa	Indonesia Jakarta
584	vaksin arah langsung jadi paksa meski orang mungkin pilih layan sehat risiko paksa langgar hak asasi manusia	Indonesia West Java
585	warga jembrana jaring razia vaksin covid	Indonesia West Java
586	berapa hari vaksin kena bu	Indonesia, Pekanbaru
587	jadi kalau lihat tulis orang ragu vaksin covid ambil positif tuju orang terlalu naif lebih kritis lihat lebih waspada mudah ajar sejarah bu siti fadilah saksi hidup coba renung	Indonesia,Jakarta
588	ikut prosedur vaksin	Indragiri Hilir, Riau
589	ayo warga lurah khusus vaksin langsung datang puskesmas cidempet syarat lihat gambar bawah	Indramayu, Indonesia
590	ngeselin pulang pulang retas sana sini lewat jalan tikus sekat sana sini vaksin rusak vaksin gratis mau bayar vaksin ketat pinjam pinjam identitas orang jaga jarak demo hoax rajalela uhh moga pandemi segera lalu	Indramayu, Indonesia
591	ayo warga lurah utama vaksin datang puskesmas cidempet syarat waktu lihat gambar bawah	Indramayu, Indonesia
592	covid sangat bahaya lindung diri keluarga protokol sehat selesai vaksin lambat rs lapang kurang oksigen cukup malam	Indramayu, Indonesia
593	ayo sempat datang tempat vaksinasi dekat	JAKARTA-INDONESIA
594	bosan lihat orang orang komentar tampak cukup informasi lapor fungsi vaksin bukan cegah infeksi cegah alami gejala parah vaksin prokes	JKT - BDO
595	mungkin demo ingat apa kata vaksin bayar bukankah kata pihak demokrasi	JKT - Indonesia
596	kalau anak besar mungkin protes besar siksa banget mana vaksin lebih murah tagih rumah sakit	JKT | ID
597	perlu bingung soal kartu vaksin print lalu aplikasi	JKT, Indonesia
598	italia wajib bukti vaksin aktivitas warga luar rumah	JKT-INA
599	paksa jangan kamu sesal aku hilang ibu vaksin benar benar kurang virus	JKT-SOC
600	kemarin list vaksin sana sini penuh akhir atas saran followers suruh puskesmas dekat akhir sinovac oke penting vaksin apa merknya penting usaha maju	JOGJA
601	tetap semangat optimis jalan hari tengah pandemi laku vaksin patuh prosedur moga sehat selalu pikir baik	Jagakarsa, Indonesia
602	astrazeneca janji tingkat produksi distribusi vaksin asia tenggara	Jailolo, Maluku Utara
603	infographic indonesia bicara vaksinasi apec informal summit	Jakarta
604	perspektif hak asasi manusia khusus hak ecosob tanggung jawab negara perintah penuh wajib lindung hak warga negara hormat hak orang jaga protokol sehat vaksin ikut anjur perintah	Jakarta
605	tadabbur sapa vaksinasi cinta ilahi	Jakarta
606	anggap salah salah ulang varian delta jauh lebih mudah tular serang semua laku jkw negatif keluarga konsisten tolak vaksin bst free handling mulai tes hingga makam peduli	Jakarta
607	vaksinasi covid anak ancol tiket gratis dufan sea world ocean	Jakarta
608	kemarin pulang kereta api syarat swab vaksinasi dosis minimal akhir mau vaksin dulu	Jakarta
609	vaksinasi dosis pertama laku bulan juli	Jakarta
610	pihak nasdem cara konsisten dukung cepat vaksinasi covid komitmen tunjuk sedia mobil vaksinasi nasdem perhati jadwal lokasi ikut jangan tinggal ayo vaksin	Jakarta
611	sama nih diabetes vaksinasi bu minggu minggu batuk lesu apa kurang batuk	Jakarta
612	sampa rumah nyata vaksin antigen stasiun suhu sini suhu beda jadi keluar nakal tambah perut keroncong mau kecil nanya nanya ibu sulit rumah akhir jadi rewel	Jakarta
613	hari suami vaksin dosis pertama moga dosis moga pulkam sehat bahagia jaya sentosa	Jakarta
614	arti survivor covid vaksin kapan	Jakarta
615	vaksin lindung gejala lebih parah teman kamar bu atlet wisma atlet vaksinasi icu smp plg makan bawang putih mentah anosmia cepat hilang	Jakarta
616	awal vaksin proses uji coba kata vaksin arti kebal infeksi vaksin lindung efek lebih parah meski vaksin proses kalau makan hoax kirain kebal	Jakarta
617	mana lokasi pusat vaksin cere	Jakarta
618	banding ln bantu buat vaksin jarak jauh	Jakarta
619	sama sama aplikasi caring protect jadwal kemarin pas tuju resepsionis malah tau apa apa soal vaksin sini vaksinasi pak cuma tau wahwww	Jakarta
620	berita populer desk nasional fotokopi ktp vaksin tambah kasus baru covid	Jakarta
621	vaksin orang perintah sinovac kerja usaha pegawai negeri mungkin az tugas sehat moderna sinopharm sinovac milik paling	Jakarta
622	apa apa lama jelas percaya vaksin anti vax alas biasa wanita selebritas takut vaksinasi tahu apa vaksin	Jakarta
623	isu awal tenaga sehat insentif lalu mendagri bilang uang daerah fokus insentif obat vaksin tuju masalah distribusi distribusi persentase rata	Jakarta
624	kartu id palsu fakta sekarang tunjuk bukti vaksin	Jakarta
625	amerika sendiri selesai covid negara ribu kasus baru beda lebih kuat t vaksinasi lindung rakyat indonesia dampak lebih parah strategi jemur buka jendela makan vaksin ikan	Jakarta
626	saksi live streaming selasa juli datang vaksin covid panggung bandara internasional sokarno hatta pkl wib	Jakarta
627	informasi info vaksin kota bekas	Jakarta
628	vaksin pertama bulan juni bulan juni kena covid sembuh sedang bulan juli kemarin jadwal vaksin cikini kapan vaksin	Jakarta
629	vaksin bulan lalu tanggal berapa hari anosmia rasa rasa asin wkwkwkwk	Jakarta
630	siapa bodoh	Jakarta
631	juta dosis vaksin siap penuh vaksinasi minggu tiga empat agustus	Jakarta
632	bijak perintah sertifikat vaksin salah satu syarat pergi urus milik layan tanya pimpin umur hidup negoro ne mbah	Jakarta
633	tiap istri mau vaksin tekan darah langsung naik jadi vaksin gagal kali hahaha alhamdulillah minggu lalu akhir hasil	Jakarta
634	banyak kasus kak terima sms aplikasi muncul jadi coba cek via website kalau sangat butuh sertifikat vaksin jalan dermaga tunjuk kartu vaksinasi sistem baik	Jakarta
635	selamat pagi salam sehat tanya mana vaksin hari terima kasih	Jakarta
636	memang banyak makanya buat alternatif travel butuh sertifikat vaksin cukup tunjuk bukti kartu vaksinasi gan sistem baik peduli lindung bro	Jakarta
637	pagi pagi pusing mikirin gimana cara biar ibu mau vaksin pake jebak tinggal daftar aja sms masuk bilang daftar laku	Jakarta
638	isoman bulan isoman ken cepet vaksin rasa awal kabar ibu hamil mau vaksin neng banget qodar tuhan kasih positif covid dulu jadi sedih moga semua baik baik masa depan my starwars sayang	Jakarta
639	banyak dok pernah alami demam anosmia tes sayang uang ketat gejala hilang vaksin skrining kata gejala kontak dekat	Jakarta
640	minta strp kartu vaksin min	Jakarta
641	arti orang orang bayar mati	Jakarta
642	vaksin malah mau bayar orang jahat mau bisnis untung presiden cepat tanggap	Jakarta
643	masuk akal sinovac milik vaksinasi sinovac massal sejak april korban sebar covid bahkan lebih gila coba beli vaksin	Jakarta
644	silah vaksin semarang utama sulit ktp bukan ktp semarang	Jakarta
645	kira kira masuk tkc indonesia berapa biaya vaksin cobod impor fungsi berapa rugi jangan pikir pasar vaksin indonesia jadi jangan pikir jadi habis dulu vaksin impor baru ppkm cabut	Jakarta
646	lepas pro kontra makin banyak orang vaksinasi	Jakarta
647	jangan salah suntik vaksin	Jakarta
648	pt bank syariah indonesia tbk bsi bekerjasama perintah kota jakarta pusat gelar vaksinasi covid masjid masjid jemput bola warga jakarta lama hari bulan juli baca lebih lajut	Jakarta
649	stok vaksin plus juta dosis cukup	Jakarta
650	padahal ibu bilang negara bisnis rakyat terus tuduh jual vaksin obat obat	Jakarta
651	ikut daftar lokasi vaksinasi covid anak usia    tahun kota depok	Jakarta
652	dokter indonesia tinggal bulan juni dokter tinggal terima vaksinasi sinovac benar cari korban kpp tinggal cukup bagai korban berani vaksinasi aman ayo evaluasi evaluasi	Jakarta
653	vaksin dosis hari pulang makan apa	Jakarta
654	benar puskesmas sering kurang tempat orang vaksinasi terkadang antri vaksinasi tutup jalan pasien obat kerjasama parpol puskesmas parpol sedia tempat field trip vaksinasi masyarakat puskesmas	Jakarta
655	arab saudi izin warga negara vaksinasi covid pergi luar negeri	Jakarta
656	mohon perhati catat penting kait polemik fotokopi ktp vaksinasi rekan rekan bp menteri sehat kpc pen bp dirjen tuju cepat mudah cc vaksinasi pak	Jakarta
657	asumsi jumlah infeksi x jumlah kasus positif kebal alami per hari tingkat lebih cepat vaksinasi	Jakarta
658	lalu halodoc online bagus daftar agustus jkt tahu daerah moga lancar lihat rapi download sertifikat vaksin pandu	Jakarta
659	vaksin anak ancol	Jakarta
660	tuips keliling sby sda besok vaksinasi az pt integra indocabinet betro klo datang bawa foto copy ktp kuota smp siang	Jakarta
661	ughh iya sama aku vaksin sinovac allah skincare x ahh glowing	Jakarta
662	tembak mati sangat cocok sabotase vaksin	Jakarta
663	yu vaksin	Jakarta
664	moga semua korban ppkm sabar sistem sehat runtuh negara banyak korban sulit cari makam goreng perintah gagal perintah temu imbang cepat vaksin	Jakarta
665	pak besok juli warga jadwal vaksin tunda batas waktu stok vaksin puskesmas bengkulu bentiring bengkulu tengah	Jakarta
666	tertawa bahak bahak	Jakarta
667	jakarta vaksinasi rendah banyak aktif jakarta	Jakarta
668	tahu kalau bagai pusat vaksinasi masyarakat lho menparekraf hadir cara virtual buka sebut sangat apresiasi langkah kerjasama poltekpar bal mang penting kait	Jakarta
669	selamat target vaksinasi jakarta dekat angka provinsi bas persen indonesia jakarta bukan jabodetabeka semua perlu kuat benar benar selamat wabah semua orang rasa sama	Jakarta
670	rubah jadwal lokasi vaksinasi dosis ikut langkah langkah daftar via jaki cek lewat min hari sejak vaksinasi pertama vaksin sinovac minggu vaksin astrazeneca via	Jakarta
671	lebih database orang peduli lindung jadi daftar masuk nomor ponsel nik lalu aplikasi sertifikat tetap keluar database nomor masuk panggil orang butuh tarung vaksin	Jakarta
672	hah vaksin baru gabung vaksin kalah awal banding	Jakarta
673	solidaritas lintas agama perlu awal beri tahu masyarakat salah paham vaksin masalah sehat sering kait ajar agama tabayyun pasinringi	Jakarta
674	warga sabar az booster baru naik haji	Jakarta
675	revisi sikap vaksin bayar perintah jamin vaksinasi gratis x sunti seluruh rakyat indonesia warga segera vaksin bagai booster imunisasi vaksin gotong royong bayar	Jakarta
676	ajar tahap kembang vaksin vaksin covid cepat dokter tolak vaksin rupa erti beda uji klinis pra uji klinis beberapa tanya alas vaksin negara cepat muncul artikel	Jakarta
677	bagaimana ppkm darurat efektif sangkut ibadah jamaah tegak hukum buat apa apa berani dagang kecil restoran akhir ppkm fokus vaksinasi besar besar biar semua giat ekonomi jalan	Jakarta
678	nyata milik tingkat vaksin asi rendah jumlah lebih tinggi banding tingkat vaksinasi tinggi kasus ledak jumlah vaksinasi turun banding indonesia	Jakarta
679	udah bulan daftar vaksin buka kuota habis hari apa antri biasa max hari minggu lebih awal kalau ramai mall artha gading central park	Jakarta
680	vaksinasi moderna waktu dekat rasa jatuh cinta astra	Jakarta
681	antri vaksin	Jakarta
682	lihat etnis persentase besar duduk etnis mau vaksinasi covid persen madura persen mang	Jakarta
683	cloudy above stated	Jakarta
684	kalau tugas vaksinasi mau kasih fotokopi ktp minta fotokopi ktp foto susu kasih hidup sangat sederhana rumit interpretasi hadap fotokopi susu	Jakarta
685	jangan peduli siapa jangan jahat manfaat sama mahasiswa jangan manfaat pandemi cipta ketidakstabilan penting kelas sama mahasiswa jangan mau tipu elit politik jahat satu lawan pandemi kampanye vaksinasi jadi sukarelawan	Jakarta
686	tempat sampah sibuk distribusi vaksin jual sate	Jakarta
687	masuk akal daerah angka tular covid tinggi tebar hoaks antivaksin demo anti pmkm masker jelas buat tangan pandemi gagal manfaat peluang sempit dunia selidik orang orang jadi korban	Jakarta
688	h vaksinasi tangan sedikit pegal perut kebas asa lapar haha	Jakarta
689	kcg kalian pernah vaksin radhiyan bayar jasa dokter cuka vaksin	Jakarta
690	h vaksinasi tangan sedikit sakit perut mati rasa lapar haha	Jakarta
691	indra rudiansyah mahasiswa indonesia ikut buat vaksin zeneca astra	Jakarta
692	revisi sikap vaksin bayar perintah jamin vaksinasi gratis x sunti seluruh masyarakat indonesia warga segera vaksin bagai booster imunisasi vaksin gotong royong bayar	Jakarta
693	pagi kak layan transjakarta surat tugas undang undang vaksin print tunjuk soft copynya tugas mohon informasi halte apa kapan jadi terima kasih	Jakarta
694	pagi kak vaksin tunjuk kartu undang bukti vaksin laku tanggal tera ymw	Jakarta
695	menko pmk pemda habis stok vaksin jangan tumpuk gudang	Jakarta
696	gejala covid eijkman muncul vaksinasi pernah kena virus	Jakarta
697	gubernur missouri mike parson kata jabat sehat dorong orang vaksin paksa jangan paksa orang ambil vaksin takut nakuti vaksinasi tahu hasil kata	Jakarta
698	vaksinasi pikir vaksinasi naik pesawat selebgram bukan	Jakarta
699	vaksin moderna bas mrna pilih bagai booster tenaga sehat picu respon tubuh lebih kuat hadap varian corona sinovac	Jakarta
700	juru bicara baca instruksi mendagri nomor tahun jelas salah satu syarat pergi pswt milik vaksinasi dosis pertama	Jakarta
701	cepat herd immunity kopimda jatim maksimal vaksinasi sektor kampus	Jakarta
702	khidmad lil ummah	Jakarta
703	update data on indonesia vaccination progress as of july pm bal st dosis nd dosis indonesia st dosis nd dosis source	Jakarta
704	aksi abdi indonesia vaksin bangkit bangsa sambut pkb harlah	Jakarta
705	nah naik kereta jarak jauh beri dosis vaksin hasil swab	Jakarta
706	banyak persen memang dominasi ibu ibu atur pasar belanja tunjuk kartu vaksin kata rikia	Jakarta
707	selamat pagi salam sehat mau tanya lokasi vaksin polres jakarta barat terima kasih	Jakarta
708	ulang tahun bulan agustus kemudian vaksin bulan agustus yaaaaaaaayyy	Jakarta
