Id	text	user_location
0	halo selamat baca lepas pro kontra makin banyak orang vaksinasi apa apa	 Tasikmalaya, Jawa Barat
1	semua orang antri era presiden bingung vaksin orang lapar antri orang miskin antri makam jenazah covid tunggu tiap hari	 jawa tengah
2	istri mau vaksin kata sampa sana suruh pulang habis kontak positif kalau positif a dokter dulu	#JagakarsaCity
3	sabar dulu vaksin jujur tanya tugas sehat anjur	#JagakarsaCity
4	gais kalau demam vaksin lepaih telan obat demam parasetamol panadol	#cyberjaya #putrajaya #melaka 
5	tinggal sinovac china beli vaksin amerika	, Indonesia
6	china sendiri beli vaksin negara bangun	, Jakarta 
7	laku vaksinasi laku suntik vaksin suntik vaksin tahu beberapa penting suntik vaksin lalu	Aceh
8	bahkan sakit bahkan hubung vaksin	Aceh
9	halo min mohon cek dm min sertifikat vaksin terima kasih	Aceh, Indonesia
10	beri vaksin sinovac riwayat sehat saraf punggung jepit	Aceh, Indonesia
11	bantu kendali vaksinasi covid seluruh indonesia	Anyer, Indonesia
12	warga bandung silah cek jadwal vaksin hari fasilitas sehat kota bandung gambar ikut daftar silah hubung hotline tera salam sehat	Arcamanik, Indonesia
13	vaksin kemarin semangat tingkat	B.Lampung
14	mau vaksin jenis label halal kandung babi jangan ragu minum alkohol hehe	BSD - Makassar
15	halo kak vaksinasi sedia usia tahun beri tahu masalah aktivasi apa	BSD City, Tangerang
16	suami teman tinggal covid vaksin x simpul vaksinasi bukan jamin bebas covid terus proses jangan sombong vaksin penting lebih taat cipta allah swt agama islam	BSDcity,Tangerang
17	suami teman tinggal covid vaksin x simpul vaksinasi bukan jamin bebas covid terus proses jangan sombong vaksin penting lebih taat sang cipta allah swt agama islam	BSDcity,Tangerang
18	vaksin puskesmas kosong pihak acara vaksinasi cukup beri gambar bagaimana tangan krisis bangsa	Badung, Bali
19	duta vaksin mark lee	Bali
20	baik sama vaksin yuk segera vaksin	Bali
21	coba daftar beberapa kali buka cuma hari selalu penuh vaksin batas min kalau misal alokasi vaksin tiap hari daftar buka langsung misal	Bali
22	coba daftar beberapa kali buka cuma hari selalu penuh batas vaksin min kalau misal alokasi vaksin tiap hari daftar buka langsung misal	Bali
23	bicara layan fasilitas sehat vaksin tempat adu	Bali
24	daftar vaksin online bagus perlu rebut nomor antri	Bali island
25	vaksinasi cara pandemi cepat akhir perintah masyarakat peran penting jaga imunitas tubuh makan makan gizi istirahat cukup minum susu entrasol platinum kaya multivitamin protein baik tubuh	Bali, Indonesia
26	coba selesai vaksin giveaway	Bali, Indonesia
27	orang rajin wudhu sholat tetap kena covid lalu masjid tutup orang vaksin tetap kena covid tinggal lebih baik usaha vaksin tutup akhir logika prof begini malang	Bali, Indonesia
28	senang sia sia jadi vaksinator tiap kali tonton masuk data orang vaksin	Bali, Indonesia
29	update informasi vaksinasi wilayah denpasar sumber ig ktp denpasar luar domisili ktp luar surat terang kerja mana lokasi vaksinasi sesuai domisili tempat kerja mana sekolah sebut lokasi siswa sekolah sebut	Bali, Indonesia
30	update informasi vaksinasi wilayah denpasar sumber ig ktp denpasar luar domisili ktp luar surat terang kerja mana lokasi vaksinasi sesuai domisili tempat kerja mana sekolah siswa sekolah	Bali, Indonesia
31	menteri pppa fasilitas vaksinasi anak butuh lindung khusus	Bali, Indonesia
32	sarap dulu kak semangat vaksin moga hari senang	Bali, Indonesia
33	hei aku gagal vaksin anjing	Bali, Indonesia
34	sayang lindung vaksin baru maksimal minggu vaksinasi sedang baru terima vaksin pertama jalan jauh tetap waspada saling kuat	Bali, Indonesia
35	baik sobat pergi sekolah vaksinasi bau banget	Bali, Indonesia
36	vaksin segar mata	Bali, Indonesia
37	orang rajin wudhu sholat tetap kena covid lalu masjid tutup orang vaksin tetap kena covid tinggal baik usaha vaksin tutup habis logika prof begini maaf	Bali, Indonesia
38	vaksinasi sekolah swab tahu	Bali, Indonesia
39	kok efek samping vaksin pertama hilang vaksin beri padahal keluh pertama vaksin sinovac	Bali, Indonesia
40	kayak pak jokowi beli vaksin pakai uang pribadi kantong lebih banyak cebong pernah sadar utang terus tambah	Bali-Indonesia
41	mungkin diinput soal ikut vaksin kerja sama rs swasta vaksin selesai surat terang dokter staff bawa semua laptop langsung diinput jadwal vaksin	Balikpapan
42	min tahu hari vaksin kodim tunda kecewa vaksin tiba kata meski hari sabtu banyak vaksin kodim	Balikpapan
43	sumber vaksin beda pra lansia biasa puskesmas a vaksin masal giat eksternal dr b makanya dipkm sekarang buka dosis dosis penuh besok jelas a b apa apoteker paham beri vaksin masalah	Balikpapan - Malang
44	hmmmm aku cium gagal vaksin hari	Balikpapan Baru
45	uji klinis kendala politik makanya awan pamer prosedur vaksin nusantara langsung depan dpr ajar genose produk indonesia akhir gagal bagai alat deteksi covid	Balikpapan Selatan, Indonesia
46	sehat gan vaksin china nya sinovac cuma pake nya aja pake aztra buat vaksin nusantara buat uji klinis dulu biar tinggal test kit covid nama genose	Balikpapan Selatan, Indonesia
47	takut jarum suntik orang remaja duduk bangku kelas sltp juang tolak vaksinasi sedang orang ajar mojokerto jawa timur hipnotis berani laku vaksinasi	Balikpapan Selatan, Indonesia
48	suruh pulang suruh jadi menteri sehat produksi vaksin masal anak bangsa antusias vaksinasi vaksin kuota kuota	Balikpapan Selatan, Indonesia
49	bismillah vaccine to sinovac otw	Balikpapan Selatan, Indonesia
50	awan pernah pamer prosedur buat vaksin nusantara depan dpr sedang trending kok masalah campur vaksin depan dpr	Balikpapan Selatan, Indonesia
51	cara sederhana saturasi oksigen rendah pasien covid sedang isolasi diri perlu tahu	Balikpapan, Indonesia
52	dosis vaksinasi sinovac stadion utama malinau hari ikut syarat terima	Balikpapan, Indonesia
53	orang infeksi covid perlu tahu cara sederhana indera cium	Balikpapan, Indonesia
54	perlu panik cara lihat sertifikat vaksin covid lengkap hotline hubung	Balikpapan, Indonesia
55	vaksin sinovac x alhamdulillah sehat vaksin demam hari badan sakit banyak istirahat makan minum vaksin asa efek hahahaha	Balikpapan, Kalimantan Timur
56	kapolda buka vaksinasi massal sektor jasa uang aceh	Banda Aceh
57	ppkm vaksin pak anies	Banda Aceh
58	wajar vaksin demam sedikit kok minum dosis pertama dosis pertama lemah dosis hari lemah beda penting tiap orang coba selamat banyak orang suka sains smp guru tinggi jadi erti cara kerja vaksin	Banda Neira
59	mana vaksin tempat	Bandar Lampung
60	fotocopy ktp lampir input tanggal lahir salah arti masuk manual otomatis isi nik data keluar otomatis jadi begini sangat penting kartu vaksin	Bandar Lampung, Lampung
61	assalamualaikum netijen salam esaka hari tani ibu vaksin kantor bapak jangan lupa vaksin pandemi cepat akhir	Bandar Lampung, Lampung
62	niat siap pagi banget biar sarap vaksin siap set akhir otw	Bandar Lampung, Lampung
63	ehh jujur tinggal vaksin benar jadi wajar takut mati coba bicara pelan pelan periksa dulu sakit bawa hipertensi vaksinasi sakit bawa insya allah sehat baik baik didik nenek	Bandar Lampung, Lampung
64	untung dr tirta lelah mohon jelas vaksin vaccine	Bandung
65	minggu depan vaksin pertama	Bandung
66	camat batununggal drs tarya map jajar pantau vaksin massal jabrix cafe desa maleer senin	Bandung
67	gejala wajah vaksinasi	Bandung
68	yasss kael vaksin	Bandung
69	masalah daerah t negara miskin vaksin sulit jangkau stok distribusi teknis operasional apa solusi obat repurposed ivm	Bandung
70	luhut perlu vaksinasi kebal hadap virus liar	Bandung
71	min mana daftar vaksin warga bandung	Bandung
72	dagang pasar purwakarta jadi sasar vaksinasi covid masyarakat	Bandung
73	aman azaaaa vaksin besok	Bandung
74	baru kemarin sayang informasi hari vaksin tiba kantor camat pindah kantor polisi dr kantor polisi operasi puskesmas pergi puskesmas daftar cara mandiri daftar kuota penuh	Bandung
75	vaksin asa paling dominan lapar tunggu	Bandung
76	kumpar sebut rangkum jumlah kabar gembira kait tangan corona indonesia	Bandung
77	vaksin euy	Bandung
78	camat batununggal drs tarya map jajar monitoring vaksin massal trans studio mall desa cibangkong senin	Bandung
79	uji vaksin lebih cara klinis ivm obat butuh resep dokter	Bandung
80	masalah daerah miskin vaksin negara sulit jangkau stok distribusi teknis operasional apa solusi obat repurpose ivm	Bandung
81	milik vaksin uji klinis lebih ivm obat butuh resep dokter	Bandung
82	min mau minta vaksinasi luar ktp bandung mana itenas	Bandung
83	bulan depan covid sedang landai silah jemput bola cara pergi rumah vaksin jangan tunggu ombak bagai	Bandung
84	antri vaksin techno park cimahi sangat panjang tadi pagi belakang gedung	Bandung
85	warga bandung ikut daftar vaksin covid indonesia yuk cek jenis vaksin interval dosis	Bandung
86	yuhuu nadip vaksin	Bandung
87	camat batununggal damping anggota dpr ri wakil ketua dprd kota bandung pantau vaksin massal taman kiara artha kabupaten kebonwaru senin	Bandung
88	yeayyy vaksin	Bandung
89	ide buka posko vaksin gratis sangat manfaat orang banyak	Bandung
90	mana vaksin bukan sinovac	Bandung
91	rektor ui tengah pandemi virus vaksin	Bandung
92	keren hai abi vaksin	Bandung
93	bima arya i warga isoman tinggal vaksinasi data sekaligus tegas vaksin efektif panggil jokowi istana bogor rabu	Bandung
94	hari mau vaksin yeay	Bandung
95	vaksin beri dipkm kejut x lebih banyak orang perlu vaksinasi vaksin pertama	Bandung
96	syarat vaksin dulu cukup bukti cepat sangkut negatif covid	Bandung
97	kantor bapak vaksin cepat semua jujur malas baru mau vaksin segera	Bandung 
98	ampun bawa mimpi vaksinasi hahahaha	Bandung - Indramayu
99	vaksin bawa fotocopy ktp aneh kok awal jelasin bawa ktp suruh bawa foto copy ktp	Bandung - Jawa Barat
100	amerika dok menteri investasi menteri dagang tum bpp hipmi sana angka vaksinasi nasional cukup tinggi lebih tinggi amerika terap masker vaksin sakit vaksin perlu pakai beraktifitas normal	Bandung - West Java
101	min data status vaksin sinkronisasi careprotection jaki mana hubung terima vaksin pertama ikut vaksin lalu tempat daftar aplikasi jaki	Bandung City
102	puncak vaksin bagai provinsi	Bandung ITB
103	ancam potong gaji hasil banyak masyarakat garut tolak vaksin corona	Bandung Indonesia
104	kata orang kena covid perlu vaksin soal anti body nya bentuk ane bingung jelasin	Bandung Kidul, Indonesia
105	vaksin bulan april yll tanggal juni positif copy gejala anggota kelas isomanisme hari salah satu anggota kelompok usia produktif pcrnya positif ct beri layan sehat baik terapi obat hari terima kasih	Bandung Kulon, Indonesia
106	saran vaksin baik bukan tolak vaksin	Bandung Kulon, Indonesia
107	vaksin bulan april yll tanggal juni positif copy gejala anggota kelas isomanisme hari salah satu anggota kelompok usia produktif pcrnya positif ct tugas sehat baik terapi obat hari terima kasih	Bandung Kulon, Indonesia
108	serah siapa mau komentar ingat pakai masker protokol sehat segera vaksinasi cari lokasi dekat cussss	Bandung Kulon, Indonesia
109	zaman pak hm seoharto polio vaksin polio hilang cacar vaksin hari vaksin makin banyak mau tanya vaksin apa cc racun tikus	Bandung Kulon, Indonesia
110	bewara vaksin besok kuota penuh verifikasi dinas sosial jadwal daftar tunggu informasi jadwal vaksin terima kasih	Bandung Rock City
111	nah nama versi gelap vaksin sekarang kumpul uang vaksin booster bulan depan	Bandung Rock City
112	takut suntik sama supporter psgj cirebon jalan vaksinasi covid	Bandung Timur, Indonesia
113	klaim vaksin beri lindung sesat cara maksimal	Bandung Utara
114	vaksin sehat sehat	Bandung barat INDONESIA
115	tenang perut sakit lapar jatah nasi milik surat vaksin sakit lemah fisik paksa vaksin bantu beras vaksin bantu sosial jerat leher orang lemah	Bandung, Indonesia
116	info vaksin kabupaten bandung lokasi telkom university stadion jalak daftar online dulu	Bandung, Indonesia
117	info vaksin kabupaten bandung lokasi telkom university stadion burung jalak daftar online dulu	Bandung, Indonesia
118	eh vaksin sekarang kmrb obgyn izin pusat vaksin izin	Bandung, Indonesia
119	qatar sama bahkan milik barcode sendiri status vaksinasi status isolasi berapa kali tangkap scan cerita isoman pura pura sehat orang sepupu eksentrik memberitahu	Bandung, Indonesia
120	obrol sore vaksin ibu laundry belah kost nya ouh mas vaksin efek mba efek kok minggu minggu sejak vaksinasi orang orang belakang vaksinasi orang tinggal antivaxx	Bandung, Indonesia
121	bumi lama perkosa nafsu manusia manusia bicara hikmah mimbar agama agama ajar hikmah muncul virus corona bahkan terus bohong vaksin sakit sebut wabah landa kini henti jenak binasa	Bandung, Indonesia
122	akhir ajak oge vaksin saukur selamat pagi menang sama	Bandung, Indonesia
123	sangat butuh bantu puskesmas jadi fokus vaksinasi benar benar andal puskesmas produktif lama juta minggu efek makan waktu tahun tahun selesai program vaksin	Bandung, Indonesia
124	jadi tau lebih baik usap dulu percuma kalau virus tubuh perlu vaksin	Bandung, Indonesia
125	ppkm banyak pergi masjid usap hati al qur vaksin jiwa dzikir cuci tangan sedekah jaga jarak maksiat insyallah aman dunia akhirat	Bandung, Indonesia
126	bandung vaksin coba daftar langsung jadwal pake nunggu buat anak atas lima tahun oke pake syarat ktp bandung lama ktp indonesia bahasa indonesia buru buru vaksinasi	Bandung, Indonesia
127	dosis vaksinasi tugas sehat rcti coverage pmn rs mata cicendo bandung	Bandung, Indonesia
128	eijkman chip elektronik vaksin covid suntik	Bandung, Jawa Barat
129	ma ruf amin sorot tangan ppkm covid    jabar vaksinasi sebut	Bandung, Jawa Barat
130	pusat vaksin covid buka umum silah datang langsung tempat daftar pusat vaksin nindya ika unhas vaksin vaksin hari senin selasa juli waktu layan	Bandung, Jawa Barat
131	dengar harga sinovac beli kota lebih mahal vaksin astrazeneca hasil lebih baik vaksin sinovac harga lebih murah beli banyak sinovac jangan vaksin korupsi	Bandung, Jawa Barat
132	nyata fakta vaksin lapar banget	Bandung, Jawa Barat
133	entah apa tuju vaksinasi al qur an justru turun derajat al qur an sendiri benar vaksin bahaya tubuh aman kalau vaksin al qur an arti alquran bahaya hmmmm	Bandung, Jawa Barat
134	tunggang tinggi angka mati vaksin bukan covid sembunyi	Bandung, Jawa Barat
135	nah aneh sekarang sinovac masuk syarat mudah umroh perintah solusi jangan vaksin tiga walaupun bayar	Bandung, Jawa Barat
136	sekarang loker mulai sertifikat sertifikat	Bandung, Jawa Barat
137	kalau vaksin jual perlu sini kalau lebih baik usah dulu ah banyak ibadah khitan laku tanah air	Bandung, Jawa Barat
138	hancur china usir china gagal vaksinasi covid revolusi tindak kriminal	Bandung, Jawa Barat
139	umrah buka vaksin sinovac jadi salah satu syarat umroh bagaimana orang vaksin tambah	Bandung, Jawa Barat
140	vaksin tidur	Bandung, Jawa Barat
141	baik vaksin gamau	Bandung, Jawa Barat
142	hebat banget punya ipar paham betul konspirasi covid chip vaksin prediksi	Bandung, Jawa Barat
143	vaksin begadang fajar vaksin lambat efek bagus haha coba	Bandung, Jawa Barat
144	pesan karang bunga rendah masyarakat mulai patuh prosedur sehat ikut anjur perintah vaksin banyak tinggal lebih lolos seleksi alam	Bandung, Jawa Barat
145	dok benar minum air kelapa netral vaksin kemarin vaksin selesai banyak teman teman minum air kelapa	Bandung, Jawa Barat
146	kabid humas polda jabar polri bekerjasama beberapa pihak gelar vaksinasi cara serentak	Bandung, Jawa Barat
147	dok ayo vaksin biar imun tubuh bentuk cara random netizens vaksin bikin badan lemas aku baru vaksin esok hari jadi sakit sakit demam mual orang indonesia percaya cara acak netizens	Bandung, Jawa Barat
148	ibadah sunnah pergi sang cipta bang sembah agen sponsor vaksin covid global	Bandung, Jawa Barat
149	jurnal bahaya mati akibat obat obat bahkan covid sembarang vaksin capai tingkat herd immunity taiccats obat obat sekarang hilang lihat dongeng orang orang milik coba hidup orang orang	Bandung, Jawa Barat
150	vaksin jamin vaksinasi kali kali satu satu cara kuat sistem kebal tubuh	Bandung, Jawa Barat
151	lalu bagaimana cara kerja vaksin	Bandung, Jawa Barat
152	keluar kota sangat butuh kartu vaksin kerja sering luar kota sangat butuh kakak vaksin asli kerja vaksin jadi	Bandung, Jawa Barat
153	innalillahi rp biaya vaksinasi sayang kimia farma bayar fotocopy ktp tetangga hehehe ayo	Bandung, Jawa Barat
154	lol baru tahu gerd komorbiditas tepat vaksin lama minggu	Bandung, Jawa Barat
155	lihat banyak masyarakat indonesia mau vaksin banyak masyarakat milik protokol sehat baik benar proposal bisnis tarik tambah masa sulit bisnis buket bunga	Bandung, Jawa Barat
156	jadi gimana abi padahal baru mau vaksin	Bandung, Jawa Barat, Indonesia
157	vaksin bismillah pertama kali mudah sehat terima kasih amin	Bandung, West Java
158	gan coba hubung nomor rumah sakit sedia vaksin	Bandung, West Java, Indonesia
159	payudara cewe suntik vaksin covid kalau burung cewe tumbuh lewat	Bandung, West Java, Indonesia
160	kok ironis kemarin tetangga baru umum puluh pusat vaksinasi pusat kapasitas jangan kira gap	Bandung, indonesia
161	ambil vaksin	Bandung,ID
162	kemarin vaksinasi rs rotinsulu bandung bawa apa apa bawa badan bawa sedekah	Bandung,Indonesia
163	nyonya minta selenggara vaksinasi lapang sulit warga wajib fotokopi e ktp vaksinasi	Bandung,Indonesia
164	vaksinasi rata rata        orang minggu akhir target vaksinasi capai tengah februari	Bandung-PLTU Palabuhan Ratu
165	terkadang puskesmas sakit kontrol beberapa kasus vaksin jatuh sakit	Bangkalan
166	vaksinasi dosis pertama	Bangkalan
167	pagi pagi kurang satu vaksin kak besok pas mau vaksin moga jadi cara ikhtiar masa pandemi	Bangkalan
168	pagi tweeps gimana lengkap vaksin sertifikat bukan vaksin laksana pon papua xx perintah cepat vaksinasi atlet latih meminimalisir sebar tular covid	Bangkalan
169	memang banyak kasus pihak kait olah abai bukti teliti bahkan tanggung jawab atas jadi sebut jadi masyarakat takut vaksin takut jadi tikus lab	Bangkalan, Indonesia
170	alam wajar orang takut jangan kata sedikit hoax tuding selidik lebih media sendiri tetap rekomendasi vaksin masalah corona reda jadi normal	Bangkalan, Indonesia
171	madura banyak masyarakat tolak vaksin bukan salah informasi media sosial memang beberapa kasus orang lumpuh vaksin padahal sehat bugar sama tolak obat sakit	Bangkalan, Indonesia
172	kata screening dulu baru kasih vaksin	Bangkalan, Indonesia
173	bagaimana dok vaksinasi sinovac	Banjarmarmasin
174	update daftar vaksin rakyat kuota orang informasi lebih lengkap hubung lima tim laksana vaksin kuota isi	Banjarmasin
175	laksana serentak provinsi bin sasar vaksinasi ribu santri pondok pesantren budi gunawan kata program vaksinasi covid santri rupa arah presiden republik indonesia joko widodo cepat capai herd immunity	Banjarmasin
176	halo kak selamat siang mau tanya kak jadi juli lalu jadwal vaksin kakak	Banjarmasin - Indonesia
177	gagal vaksinasi nomor tiket vaksin sama orang orang vaksinasi adik	Banjarmasin - Indonesia
178	antri vaksin antri belanja	Banjarmasin, Indonesia
179	gubernur jateng nilai antusias anak anak tinggi vaksin covid pihak dorong cepat vaksinasi benteng anak ajar tatap muka mulai bayar tinjau	Banjarnegara
180	banjarnegara kodim reviews preparations for covid vaccinations for wbp banjarnegara prison banjarnegara tni soldiers kodim banjarnegara reviews preparations for covid vaccinations for inmates at wbp penitentiary class iib banjarnegara prison	Banjarnegara, Indonesia
181	stan vaksin covid tni polri polsek bantar gebang polres bantar gebang libat satpol pp kota bekas rs juwita bekas kuota bagai upaya polri bantu cepat gera vaksinasi covid	Bantargebang, Indonesia
182	selebriti gebby vesta marah bandara bikin susah naik pesawat padahal vaksin pcr negatif	Banten
183	antri vaksin pertama kodim cilegon	Banten, Indonesia
184	mau vaksin takut jarum bengkok	Banten, Indonesia
185	vaksin baru dl kopi	Banten, Indonesia
186	anak tetangga vaksin jg bs daftar dicancel dhal bilang mau tambah batpil tugas sehat ngomong paksa	Banten-Depok
187	anak tetangga vaksin jg daftar bs dicancel dhal bilang mau tambah batpil tugas sehat bicara paksa	Banten-Depok
188	vaksin tip kok banyak pihak institusi menteri sehat institusi sehat acara vaksinasi bagaimana	Bantul, Indonesia
189	bagai hasil bisnis	Banyumanik Semarang
190	perintah sedang gencar gencar program vaksinasi ikut anak anak usia    tahun ayo ajak putra putri adik adik lingkung vaksinasi	Banyuwangi, Indonesia
191	lebih butuh sunti dana sunti vaksin	Banyuwangi, Indonesia
192	minta bantu hai vaksinasi mulai tahun baik	Banyuwangi, Indonesia
193	dukung situasi darurat bin wajar bantu vaksinasi	Banyuwangi, Indonesia
194	ngumpul kalau mau vaksin jangan demo kalau mau kwkwk ww	Banyuwangi, Indonesia
195	informasi vaksin bwi daftar online	Banyuwangi, Indonesia
196	klarifikasi hoaks vaksin covid bikin badan kebal	Banyuwangi, Jawa Timur 
197	daftar tips siap vaksin online banyuwangi proses jalan lancar	Banyuwangi, Jawa Timur 
198	vaksinasi lambat salah satu banyak upacara mau vaksinasi pakai salam pakai road show bikin lambat politisasi capek begini	Banyuwangi-Indonesia
199	salah satu salah baru jalan as indonesia kurang juta bukan susut kirim vaksin covid moderna as indonesia memang jadi tahap tahap pertama banyak dosis vaksin moderna tiba juli tahap desember	Batam
200	vaksin covid beri kebal bunuh virus cegah mati jamin bebas henti sebar orang hilang perlu batas jalan tutup topeng bisnis	Batam-Indonesia
201	paruh keluarga besar infeksi covid vaksin hari isoman sembuh tinggal mertua kakak mau vaksin kisah nyata bukan saran milik vaksin bantu kena	Batang, Indonesia
202	nunggu vaksin percaya kok covid alhamdulillah kabupaten zona kuning	Batang, Indonesia
203	moga bukan dar slogan kapolri tindak tegas sebar hoax putar pandemi vaksin ppkm tunggu percaya masyarakat tegak hukum	Batu Ceper, Indonesia
204	mbc kenal indonesia vaksin jelek kasus covid rendah tepuk tangan riah dulu	Batu City
205	jangan begadang sehat vaksin	Batu, Indonesia
206	bukan mau vaksin vaksin bentuk pil sirup	Baureno-Bojonegoro
207	bingung apa vaksin	Bekasi
208	dr faheem younus vaksin covid ibarat sabuk kam kurang dampak celaka	Bekasi
209	dpr minta perintah evaluasi vaksin sinovac	Bekasi
210	cileupeung paan tanggung jawab	Bekasi
211	vaksinasi pintu pintu bin sorot turut berita	Bekasi
212	vaksin psbb ppkm henti pandemi lalu apa obat mujarab lindung masyarakat covid orang teman tanya lalu jawab ganti presiden	Bekasi
213	urus vaksinasi	Bekasi
214	edukasi literasi digital hindar sebar berita hoax vaksin about	Bekasi
215	jangan pergi vaksin	Bekasi
216	ayo jeno vaksin bulan april	Bekasi
217	jangan pergi vaksin sama sekali	Bekasi
218	memang benar teman pernah imunisasi vaksin bayi badan sehat sehat malah baik pernah sakit sama sekali	Bekasi
219	kakak vaksin	Bekasi
220	penting screening sehat vaksin jujur tenang darah naik jangan lupa banyak minum air putih vaksin	Bekasi
221	memberitahu pikir china milik sinovac sinopharm beli indonesia china vaksin pfizer rakyat	Bekasi
222	baca balas banyak vaksin bawa fotokopi ktp nya arti pandemi darurat darurat darurat woyyyyy buat fotokopi halo ciri ciri birokrasi indonesia jangan dulu pakai fotokopi	Bekasi
223	hadap situasi yakin orang buat vaksin mpok biasa bersih rumah vaksinasi x hari tanya kalau vaksin ambil ambil	Bekasi - Sidoarjo - Surabaya
224	bilang vaksin pak sayang sekali vaksin x vaksin lengkap mumpung gratis laku	Bekasi - Sidoarjo - Surabaya
225	nyata mpok takut tetangga vaksin gor demam semua infus makanya takut jadi apa apa	Bekasi - Sidoarjo - Surabaya
226	status vaksinasi	Bekasi Barat, Indonesia
227	ppkm cegah ramai smartfren gokil max vaksin silah review sini check it out	Bekasi Barat, Indonesia
228	jomplang dki vaksinasi nasional bukti memang beda kelas	Bekasi Barat, Indonesia
229	baik mati vaksinasi tiap hari	Bekasi Selatan, Indonesia
230	vaksin vaksin titan jadi tidur tidur lama	Bekasi Selatan, Indonesia
231	sarah gilbert buat vaksin astrazeneca mau untung	Bekasi Selatan, Indonesia
232	min mohon info kapan buka vaksinasi massal soal banyak nunggu bagai syarat jalan jalan kerja	Bekasi Selatan, Indonesia
233	lihat tweet langsung install aplikasi jaki keren banget aplikasi pre screening hasil baru download vaksin tinggal print hasil pre screeningnya terima kasih informasi	Bekasi Selatan, Indonesia
234	terkadang bagai area bisnis segala macam broker selesai sertifikat vaksin	Bekasi Selatan, Indonesia
235	festival vaksin merdeka mula jadwal gelar pekan bulan agustus maju jadi sabtu juli buka umum vaksin anak anak usia    tahun	Bekasi Utara, Indonesia
236	memang vaksin tetap vaksin isi blutut	Bekasi jatiasih 
237	kalau booster vaksin bayar sangat	Bekasi, Jawa Barat
238	walaupun baru pertama kali vaksin efek sekarang rasa efek gaeess jangan sama sama covid pernah jatuh sekarang muntah diare demam cium bau apa sesak	Bekasi, Jawa Barat
239	gitu kayak nunggu antre suntik vaksin tinggal nunggu panggil aja	Bekasi, Jawa Barat
240	plssss tiap mau vaksin kendala misal kayak tiba tiba masuk angin rasa sakit bagaimana cara vaksin flu	Bekasi, Jawa Barat
241	tolak vaksin ivermectin banyak tempat penting atas hidup orang	Bekasi, Jawa Barat
242	apa jadi vaksinasi enam bulan lalu	Bekasi, Jawa Barat
243	ah benar sekali vaksin kakek tua datang pagi daftar tolak daftar lalu jaki datang sendiri siapa tahu cara jaki sedia vaksinasi patut sambut hangat	Bekasi, Jawa Barat
244	pak tulis kabar baik isi berita vaksin pengaruh parah vaksin parah wartawan suka buat berita aneh	Bekasi, Jawa Barat
245	epson kemarin habis vaksin hari libur istirahat	Bekasi, Jawa Barat
246	teman teman keluarga pernah vaksin sinovac kena covid orang tua tinggal istri anak teman rawat isolasi diri alhamdulillah selamat	Bekasi, Jawa Barat
247	selamat pagi sehat sehat semua vaksin ayo vaksin	Bekasi, Jawa Barat
248	besar teman kena covid vaksinasi benar benar sembuh anosmia hari gejala sehat	Bekasi, Jawa Barat
249	sempat vaksinasi buru	Bekasi-Jawa Barat-Indonesia
