Id	text	user_location
1378	vaksin patut terima kasih semua pihak juang datang vaksin benar benar bayang situasi langsung juang layak apresiasi baik	North Sumatra, Indonesia
1379	kuat kualitas sistem kebal tubuh tidur cukup jam hari makan atur gizi imbang olahraga jemur banyak minum stres begadang tingkat asupan vitamin d c mineral misal makan banyak sayur ikan laut cuci hidung vaksin	North Sumatra, Medan
1380	pilih vaksin rasa vaksin baik sekarang	Nuhakepa, Indonesia
1381	jawab banyak wakil hipertensi ibu hati pak hipertensi semua vaksin bawa sop bawah rutin minum obat kontrol	Nuhakepa, Indonesia
1382	partai adil sejahtera prima dukung langkah presiden joko widodo batal rencana vaksinasi bayar mulai presiden wakil presiden gubernur seluruh jabat tinggi negara lama satu bulan kata wasekjend prima rudi hartono	Nusa Tenggara Barat, Indonesia
1383	bantu ibu jawab iya ibu vaksin sinovac suntik aman ngantuk lapar malah lebih sehat tambah makan banyak abang makan vaksin az baru suntik habis vaksin antuk enak badan tambah rasa sakit tempat sunti	Nusa Tenggara Timur, Indonesia
1384	jauh baca isoman vaksin jadi cerita alam suami kena suami vaksinasi kantor bulan maret vaksinasi bulan april salah satu masjid banjarmasin dinas sehat kantor flyer cek ig dinas sehat kota banjarmasin	Nusantara
1385	rasa efek sama sekali vaksin pertama pak sedang vaksin badan langsung turun demam demam kata gubernur efek samping dosis lebih asa dosis	PALEMBANG
1386	kunjung stand vaksinasi polri kapolres ponorogo ingat warga tetap waspada	Pacitan, Indonesia
1387	misi kalian promosi mau print sertifikat vaksin bentuk kartu atm ktp jom dm wa no	Padang Barat, Indonesia
1388	misi kalian promosi mau print sertifikat vaksin bentuk kartu atm ktp jom dm wa at	Padang Barat, Indonesia
1389	doa hari sabtu vaksin marah kalau izin hahahah	Padang Timur, Indonesia
1390	kata vaksin laku bagaimana laku sendiri	Padang Utara, Indonesia
1391	orang vaksinasi tolak masuk lapang	Padang, Sumatera Barat.
1392	vaksin kemarin swab hari moga baik baik	Pagaralam
1393	tunggu vaksin tiga	Pagelaran, Malang
1394	serah masyarakat situasi segera akhir pilih jaga jarak pakai masker cuci tangan jaga daya tahan tubuh kuat olahraga jemur makan makan gizi plus vaksinasi mudah baik	Pakuan Ratu, Indonesia
1395	buat judul berita vaksin jangan negatif vibrasi positif aja biar sehat selalu	Palangka Raya, Indonesia
1396	vaksin data masuk nomor tiket pakai kontak e mail pedululindungi respon panggil gagal lalu bagaimana	Palembang
1397	sekarang kalau bilang benar macam macam tetap jalan tugas sehat sendiri positif semua komunikasi publik mana makin banyak komobird mati akibat tes vaksin vaksinasi banyak tinggal	Palembang
1398	anak vaksinasi	Palembang
1399	soal stok vaksin daerah luar jawa kondisi hampir sama suplai pusat batas banyak vaksin	Palembang - Indonesia
1400	kalau sumsel pas orang sadar mau vaksin senang hati vaksin ehhh stok kosong tanya puskesmas dekat kata kirim pak padahal bantu ikut promosi vaksinasi perlu tahu bukan satgas covid soal satgas banyak pamer rompi	Palembang City
1401	rasa kebal tahu vaksin	Palembang City
1402	datang jam orang antri vaksin luar biasa	Palembang, Indonesia
1403	vaksin nyata ngantuk mimpi ketemu almarhum kakek	Palembang, SUM-SEL, Indonesia
1404	buah buah sayur sayur vitamin olahraga madu semua bagus bukan ganti vaksin vaksinasi segera mungkin ambil merek vaksin apa sedia	Palembang, South Sumatra
1405	cover tempo video replay vaksin timang timang astrazeneca	Palmerah, DKI Jakarta
1406	lindung seluruh warga negara indonesia perintah cepat program vaksinasi nasional cepat selesai bentuk herd immunity situasi capai kondisi pandemi nyata akhir dukung jokowi	Palu sulawesi tengah
1407	realisasi anggar vaksinasi sampang efektif	Pamekasan
1408	abai vaksinasi gagal ambil bst	Pamekasan
1409	swab negatif bulan juni jadwal vaksin agustus gas	Pamulang
1410	ioc sadar banyak atlet negara tinggal vaksin atlet tolak vaksin siapa	Pamulang, Indonesia
1411	fyi atlet olimpiade olimpiade wajib vaksinasi ioc dorong semua atlet ikut program vaksinasi negara masing masing	Pamulang, Indonesia
1412	jadi tangkal vaksin minum vaksin	Pangkajene Kepulauan, Sulawesi
1413	yuk warga sulsel ikut vaksin tulis waktu tempat guys	Pangkalan Baru, Indonesia
1414	sertifikat vaksin menteri sehat bukan syarat administrasi apa lalu	Pangkalan Pisang - SIAK
1415	padahal benar banyak surat edar polisi instansi perintah jadi sertifikasi vaksin bagai salah satu syarat selenggara administrasi	Pangkalan Pisang - SIAK
1416	padahal benar banyak surat edar polisi instansi perintah jadi sertifikasi vaksin bagai syarat urus administrasi	Pangkalan Pisang - SIAK
1417	vaksin bagus sakit	Pangkep-Makassar
1418	tinggal vaksin	Papua, Indonesia
1419	vaksinasi siswa lanjut	Parigi, Indonesia
1420	jadwal vaksin hari bahkan kemarin dada kanan sakit	Patemon, Gunungpati, Semarang
1421	sholat subuh jalur vaksin temu mantan	Pati,jawa tengah
1422	sholat subuh antri vaksin temu mantan	Pati,jawa tengah
1423	jgnla banding vaksin dorong lebih banyak orang malaysia vaksin	Pearl Island
1424	tweeps perintah terus cepat kirim vaksin covid target vaksinasi mental masuk atlet ikut pekan olahraga nasional papua bulan oktober tahu pon papua	Pekalongan
1425	vaksin e coli sabi kali ngabbb	Pekalongan, Indonesia
1426	punya informasi jadwal vaksin terima kasih	Pekalongan, Indonesia
1427	jelang tahun kopdar varian nyapek z vaksin habis	Pekan Baru, Riau
1428	pusing vaksin	Pekan Baru, Riau
1429	semua vaksin produksi covid eksperimen	Pekan Baru, Riau
1430	ribu ajar madura tolak vaksinasi	Pekanbaru
1431	buat mau vaksin mau pakai produk cina mau jadi kelinci coba	Pekanbaru
1432	diskes minta paruh vaksin riau beri pekanbaru	Pekanbaru
1433	kemenkes dinas didik bekerjasama dinas sehat vaksinasi	Pekanbaru
1434	vaksin sinovac	Pekanbaru, Riau
1435	efek vaksin ngantuk dehidrasi tangan suntik pegal	Pemalang, Indonesia
1436	buah studi baru china ungkap turun antibodi vaksin sinovac jadi satu bulan sunti dosis	Penjaringan, Indonesia
1437	indonesia terus datang vaksin covid cepat agenda herd immunity	Penjaringan, Indonesia
1438	alir vaksin covid datang hingga produksi biofarma	Penjaringan, Indonesia
1439	vaksin bayar jokowi hapus vaksin bayar batal bela bijak jabat ganda kuncoro mundur siapa benar bodoh tahan negeri	Pesanggrahan, Indonesia
1440	ngotot buka sekolah takut jarum suntik isu bunuh massal lewat vaksin jadi bincang kampung minta solusi mau solusi	Pondok Aren, Indonesia
1441	ngotot buka sekolah takut jarum suntik isu bunuh massal lewat vaksin jadi obrol kampung minta solusi kasih solusi	Pondok Aren, Indonesia
1442	miskin butuh kartu mau vaksin butuh ktp mau bikin ktp orang butuh vaksin orang vaksin bersin badan masuk angin nyata hari dapur dingin keluar cari nafkah banyak tugas bubar ah aisyah benam diri tanah	Pondok Aren, Indonesia
1443	laksana vaksinasi covid indonesia power seluruh unit bangkit selalu terap protokol sehat baik	Pondok Rajeg, Cibinong, Bogor 
1444	arti mobile vaksin laku vaksinasi jadwal gbk perlu jauh jauh gbk	Pondokgede, Indonesia
1445	sakit virus bahaya vaksin	Pondokgede, Indonesia
1446	vaksin pagi rasa lebih baik sekarang	Ponorogo, Indonesia
1447	lalu bagaimana tiap hari temu ribu orang bagai daerah tetap tular bagaimana kasus ramai vaksinasi teliti benar benar bukti tular antar manusia	Ponorogo, Indonesia
1448	cuma main main tinggal jawab hiv jadi vaksin kalau vaksin covid laku kurang tahun	Ponorogo, Indonesia
1449	cegah covid vaksin	Pontianak
1450	selamat pagi sahabat semua jaga diri keluarga pandemi segera lalu mau vaksin biar jatah vaksin cukup pikir normal	Pontianak
1451	pkk pontianak dukung vaksinasi lalu sosialisasi	Pontianak
1452	berita kalbar ratus milenial ikut vaksinasi massal sama	Pontianak
1453	efektif cegah covid vaksin tingkat disiplin	Pontianak
1454	selamat pagi sahabat semua jaga diri keluarga pandemi segera lalu mau vaksin biar jatah vaksin cukup pikir biasa salam waras	Pontianak
1455	dukung cepat capai apresiasi vaksinasi dpp kalbar gelar vaksinasi milenial	Pontianak
1456	ironis hari selasa lebih banyak kasus konfirmasi telusur banding daftar vaksin hari	Pontianak, Indonesia
1457	presiden joko widodo akhir juli juta vaksinasi agustus juta dosis vaksinasi per hari semua pihak kerja keras capa	Poso, Sulawesi Tengah
1458	datang sini vaksinasi mulai hari alun kidul	Prambanan, Indonesia
1459	punya vaksin sertifikat vaksin keluar gimana min	Prigen, Indonesia
1460	grup wa desa tiap hari pak tugas puskesmas informasi layan vaksinasi camat tempat	Puerto Rico,mbanyumas
1461	covid vaksin sedia sinovac astrazeneca moderna pfizer novavax daftar darah yesus vaksin	Pulau Punjung, Indonesia
1462	covid virus sama flu awal mati akhir vaksin sekarang banyak pilih obat flu bahkan toko toko kecil jangan harap covid hilang harap vaksin kuat vaksin nusantara obat	Pulo Asem Jakarta
1463	makhluk kena covid walaupun narasi aku positif hari semua orang sakit vaksin kemarin vaksin sakit hilang aku mau kasih vaksin booster mau nyerah mau tolak kontol orang pasir kucing buat tanah apa	Purbalingga - Tangerang
1464	makhluk pernah jangkit covid walaupun narasi aku positif hari semua orang sakit vaksin kemarin vaksin sakit hilang mau kasih vaksin booster mau ngasih mau tolak kontol orang pasir kucing apa tanah apa	Purbalingga - Tangerang
1465	share data target vaksin masyarakat jawa tengah kapan berapa data syarat terima bantu	Purbalingga, Indonesia
1466	booth vaksin covid polisi karangreja puskesmas karangreja puskesmas karangjambu sabtu	Purbalingga, Indonesia
1467	repost mobile vaksinasi program jemput mobil vaksin unjung daerah padat duduk lokasi wilayah jakarta unit mobil vaksin gerak sedia	Purbalingga, Indonesia
1468	keluar perlu vaksin ra intuk kon pikir	Purwodadi, Indonesia
1469	mana vaksin	Purwokerto
1470	tanda rsj vaksin ktp mbi due	Purwokerto
1471	juta warga china pantau bill gates chip tanam vaksinasi indonesia bawah awas perintah china vaksin china awan chip sebut asal jakarta	Purwokerto - Jakarta
1472	memang benar pajan terus terus tugas sehat antibodi turun informasi awal uji klinis sinovac bulan vaksinasi jadi turun titer sin penting booster tenaga sehat malaysia vaksin kena	Purwokerto Selatan, Indonesia
1473	yakin vaksin nusantara hasil orang eijkman lipi lebih banyak dengar banci asal rspad bangga dokter militer	Purwokerto Selatan, Indonesia
1474	memang benar papar terus terus tugas sehat antibodi turun informasi awal uji klinis sinovac bulan vaksinasi jadi turun titer sin penting booster tugas sehat malaysia vaksinasi kena	Purwokerto Selatan, Indonesia
1475	polri terus sinergi tangan pandemi cepat vaksinasi massal kuat ppkm mikro salur bansos selalu patuh protokol sehat	Purwokerto Utara, Indonesia
1476	terima kasih pakai cara kok akhir sertifikat vaksin pertama padahal cek web pernah yahuhu	Purwokerto Utara, Indonesia
1477	allah akhir sertifikat vaksin sekian lama bolak balik buka situs peduli lindung selalu	Purwokerto Utara, Indonesia
1478	jends sskit cov habis berapa minggu waktu baik vaksin	Purwokerto, Jawa Tengah
1479	jens kalau vaksin stasiun nomor an biasa jam berapa	Purwokerto, Jawa Tengah
1480	jakarta sedang rencana musnah etnis tahu mayoritas duduk asli papua vaksin kemudian paksa pound kemudian larang kunci papua	Rajabasa | Bandarlampung
1481	segera daftar gelar vaksinasi covid unpas masyarakat umum ajar ikut cara daftar	Rancaekek, Bandung Timur
1482	bagai kampanye vaksinasi	Rejang Lebong - Bengkulu 
1483	simak kisah beberapa warga ntt sulit vaksinasi	Rejang Lebong - Bengkulu 
1484	mana unggah sertifikat vaksin	Rembang, Jawa Tengah 
1485	turut pola pikir kurang tepat pengaruh lingkung satu desa satu saling peduli insya allah turut lawong vaksin milik tuju baik	Rembang, Jawa Tengah 
1486	puluh anak istri keluarga polisi ambil vaksinasi covid polres inhu	Rengat Barat, Indonesia
1487	informasi min sedia vaksin cov terima kasih	Riau, Indonesia
1488	meski vaksin habis kamu tetap semangat sama rekan kerja	Riau, Indonesia
1489	siswa program vaksinasi covid anak anak remaja	Riau, Indonesia
1490	tingkat ppkm pekanbaru titik titik ikut jaga tugas lewat swab bicara vaksin	Riau, Indonesia
1491	intip antusiasme mahasiswa malang ikut vaksinasi covid	Riau, Indonesia
1492	tingkat urus pkm ajak semua pihak sinergi dukung cepat vaksinasi	Riau, Indonesia
1493	sebar erti mudah selinap jurang hoax vaksin kandung virus lucut mampu infeksi lucut vaksin buat orang positif covid    vaksin suntik sistem kebal merespon	Riau, Indonesia
1494	vaksin cegah mati akibat infeksi virus corona corona	Riau, Indonesia
1495	ilmuwan vaksin covid cegah mati kurang risiko tular	Riau, Indonesia
1496	nyata vaksin sinovac lamban lawan virus corona	Riau, Indonesia
1497	kondisi indonesia bebas varian delta sri mulyani vaksin prokes	Riau, Indonesia
1498	tingkat ppkm pekanbaru titik titik ikut jaga tugas lewat swab wajib vaksin talk talk think do talk	Riau, Indonesia
1499	banjir jauh pabrik vaksin vaccine	Riau, Indonesia
1500	vaksinasi bin ribu siswa provinsi	Riau, Indonesia
1501	ribu ajar hingga lansia vaksinasi jakarta pusat	Riau, Indonesia
1502	cepat vaksinasi tiga tenaga sehat baru telepon dokter surabaya tinggal pesan rumah sakit bangun alat bawa masuk dokter terus sekarat siapa rawat pasien pasang ventilator perang hari hari	SALATIGA
1503	surat undang jalan vaksin teman teman daftar vaksin domisili tetap surabaya terbit surat undang bagai surat jalan vaksin universitas airlangga	SC lt.2, Kampus C, Surabaya
1504	kalau mau vaksin allah males banget mandi musim dingin begini	SEMARANG
1505	kalo mau vaksin allah males banget mandi musim dingin begini	SEMARANG
1506	alami sekarang vaksin tembak	SERANG BANTEN Indonesia
1507	jawa barat informasi semua stok vaksin beri masyarakat vaksin pertama kemudian pemprov tunggu kirim kuota pusat tuju masalah data stok distribusi naik warga tahu kapan bus vaksinasi	Salatiga Indonesia
1508	beli vaksin tahun depan kota kabupaten beli vaksin sendiri	Samarinda
1509	tenaga sehat tinggal vaksinasi	Samarinda
1510	wal informasi vaksin gratis ngab	Samarinda
1511	kalau informasi stadium dm vaksin please	Samarinda
1512	nunggu bulan bulan bahasa perintah vaksin sedia banyak jadi lebih suka infeksi cmiiw	Sanggau kalimantan barat
1513	antusiasme mahasiswa jawa tengah ikut vaksinasi laku perintah vaksinasi lupa ucap terima kasih pak jokowi ajak mahasiswa seluruh indonesia vaksinasi	Sawangan, Indonesia
1514	presiden umum lockdown ppkm longgar mulai juli pasar swalayan dagang pinggir jalan buka prosedur perintah daerah tugas pantau buat bijak masing masing daerah bagai jenis bantu sosial kemudian salur distribusi masyarakat vaksinasi cepat	Sawangan, Indonesia
1515	bukan gemar besar salah kj bahkan bukan gemar besar benar benar omong kosong covid mana mana bahkan supermarket covid sana beda hari teman vaksinasi covid kt ppv	Selayang
1516	alam covid doa sembuh moga jauh covid jaga diri ambil vaksin	Selayang-Taiping
1517	walaupun milik beda tuju utama ambil vaksin lindung keluarga jadi korban covid	Selayang-Taiping
1518	buat sertifikat vaksin syarat sangat kecil persentase vaksin sedang terima vaksin antre mana	Selong, Indonesia
1519	mirip orang tua pak milik sakit ibu alhamdulillah alami gejala ringan nyata positif covid alhamdulillah pernah vaksin sinovac x	Semarang
1520	terima kasih info kemarin bulan juni mudah vaksin sama teman teman ssh unika soepra uin	Semarang
1521	vaksin buat surat terang dokter dulu	Semarang
1522	teman kantor kemarin kasus nik lebih canggih malah dobel nik milik nik vaksin jadi sobat vaksin untung tugas vaksin baik vaksin surat bukti vaksin cetak cara manual bukan sistem	Semarang
1523	lama tingkat ppkm jalan kereta api jarak jauh pulau jawa kartu vaksinasi	Semarang
1524	begini pak mau vaksin rumit padahal daerah demak vaksin kosong semarang malah suruh pergi kata utama domisili padahal jelas tera umum se jawa tengah	Semarang
1525	baca artikel pagi indra rudiansyah anak bangsa ikut tim sarah gilbert temu vaksin astrazeneca bagus indra kuliah program dokter klinik jenner institute oxford university orang tua bangga	Semarang
1526	mulai juli lama ppkm level ka jarak jauh jawa wajib pakai kartu vaksin	Semarang
1527	begini pak mau vaksin rumit padahal daerah demak vaksin kosong semarang malah suruh pergi kata utama domisili padahal jelas tera umum seluruh jawa tengah	Semarang
1528	salah negara tangan covid jadi alas orang benar buat tuduh vaksin senjata bunuh massal bukti semua orang gugat	Semarang - Cilegon
1529	kalau sakit paksa vaksinasi masyarakat takut khawatir kalau pergi kalau tunjuk surat terang vaksin lalu abai sakit laku baksib akhir mati sopow tanggung jawab	Semarang - Indonesia
1530	nekat coba vaksin ots puskesmas dekat rumah antri habis ketemu temen sana nomor antre isterinya no antri pagi nomor antre tamat pagi	Semarang - Jakarta
1531	ayo tetap patuh protokol sehat segera vaksin jaga sehat daya tahan tubuh tetap prima	Semarang Barat, Indonesia
1532	memang benar sehat sakit bukan vaksin allah meridhoi sakit allah ridha sehat sehat ajar jauh	Semarang Barat, Indonesia
1533	tempat pak vaksin suruh cepat cepat pdhl data sedang dokter	Semarang Barat, Indonesia
1534	terlalu paksa ingat kepala sekolah minta vaksin guru brengsek	Semarang Barat, Indonesia
1535	memang benar sehat sakit bukan vaksin allah meridhoi sakit allah kati sehat ajar jauh	Semarang Barat, Indonesia
1536	vaksin hi lab hi	Semarang Selatan, Indonesia
1537	indonesia juta bahan baku vaksin sore	Semarang Tengah, Indonesia
1538	lumayan kalau buat vaksin gratis buat vaksin warga kabupaten jawa	Semarang Timur, Indonesia
1539	siap vaksin	Semarang,  Indonesia
1540	vaksin hari titik terang doa orang orang rumah sehat sehat amin	Semarang, Indonesia
1541	tiap dagang orang jual layan prosedur swab vaksin wajib	Semarang, Jawa Tengah
1542	bangun tidur ucap selamat pagi suara antuk satu jam kemudian balas malah bicara orang mau vaksin acak	Semarang, Jawa Tengah
1543	ketua dprd ingat dkk tambah poin massa	Semarang, Jawa Tengah
1544	baca utas buat lebih sadar asma jangan sakit rawat anak nenek usia    tahun yakin vaksinasi lengkap kerja wfh wfo terima kasih doa cepat sembuh amin semangat	Semarang, Jawa Tengah
1545	pak vaksin pusat vaksin uin walisongo vaksin uin walisongo tempat bawah info bingung	Semarang, Jawa Tengah
1546	habis vaksin kok jadi lapar ngalamin sama	Semarang, Jawa Tengah
1547	surat surat penting selalu ambil sim stnk ktp lebih penting sekarang surat vaksin kartun vaksin kalau bawa keluar	Semarang, Jawa Tengah
1548	salah kemarin makan gaco perut asa sakit lalu lucu sedang antri vaksin lucu	Semarang, Jawa Tengah
1549	cara transaksi online kerja sama gojek grab free ongkir kalau pak ojol bekerjasama awas ketat perintah orang orang pilih sesuai prosedur selalu laku periksa swab vaksinasi	Semarang, Jawa Tengah
1550	haji umroh salah satu syarat perintah saudi vaksin meningitis vaksin covid jadi mana kamu anti vax haji umrah	Semarang, Jawa Tengah
1551	cukup tunjuk sertifikat vaksin pertama first	Semarang, Jawa Tengah
1552	hari tiga cm rebah efek samping vaksin cuma terlalu mental kuat baja fisik besi karat	Semarang, Jawa Tengah
1553	bismillah punya asma jangan sakit amin doa suami sisi rawat anak anak nenek mertua sendiri tetap wfh wfh cepat sembuh buat semua sakit vaksin vaksin mau vaksin usir hutan	Semarang, Jawa Tengah
1554	fungsi vaksin risiko mati akibat covid dasar kelompok umur vaksin vaksinasi lengkap terima vaksin lengkap tiap kelompok umur milik turun risiko mati akibat covid	Semarang, Jawa Tengah
1555	temu kasus covid    serang anak anak meski persentase mati sangat kecil banding kelompok lansia perintah cepat tindak selamat generasi bangsa indonesia	Semarang, Jawa Tengah
1556	cara transaksi online kerja sama gojek grab gratis ongkos kirim kalau pak ojol bekerjasama awas ketat perintah orang orang pilih sesuai prosedur selalu laku periksa swab vaksinasi	Semarang, Jawa Tengah
1557	coba kurang hari cek punya tadi malam nyata tanggal masuk bulan juni kalau tanggal vaksin hasil kalau hasil coba maju tanggal mungkin tugas salah klik tanggal moga hasil	Semarang, Tegal, Jakarta
1558	saudara vaksinasi kalau mungkin tugas input data vaksin kak kalau mau proteksi mungkin langsung tanya faskes vaksin kakak	Semarang, Tegal, Jakarta
1559	menko bumn urus vaksin menko tanam modal urus covid menhan urus obat cacing menko kesra urus darurat militer menko polhukam urus sinetron mensos marah cari kompor presiden bahan makan lucu negara senang warga milik kebal tingkat	Semarang,Central java (indones
1560	halo selamat pagi forward group wa keluarga garpu tala bagai vaksin corona	Semarang-Solo 
1561	bin vaccination team arrived in makassar city then	Serang, Indonesia
1562	helldy minta industri cilegon vaksinasi karyawan	Serang, Provinsi Banten
1563	indah alam semesta nikmat pandemi langsung patuh protokol sehat pakai masker jaga jarak jauh ramai jangan lupa vaksin	Serpong, Indonesia
1564	ayo vaksinasi patuh protokol sehat	Serpong, Indonesia
1565	perintah libat banyak pihak suksesi vaksin covid pesan ketua umum acara sebut	Siak Riau
1566	habis vaksin tidur lebih awal bangun pagi moga biasa haha	Sidoarjo, Indonesia
1567	vaksin baru besok	Sidoarjo, Indonesia
1568	pria vaksin mungkin lemah	Sidoarjo, Indonesia
1569	sdf ayo gan mau print sertifikat vaksin ukur ktp dm wa seger cuma nanya nya waktu sama walaupun lokasi sukodono jangan risau iso cod link sertifikat vaksin gan hindar palsu insya allah bukti sendiri	Sidoarjo, Jawa Timur
1570	sdf vaccine informasi bro	Sidoarjo, Jawa Timur
1571	sdf ayo gan mau print sertifikat vaksin ukur ktp dm wa murung cuma nanya nya aja sama malah lokasi sukodono jangan risau iso cod vaksin link sertifikat gan hindar palsu insyaallah bukti sendiri	Sidoarjo, Jawa Timur
1572	kalau tempat bukan swab cek suhu badan cek tensi darah selesai vaksin drop	Sidoarjo, indonesia
1573	vaksinasi pintu pintu	Simalungun, Sumatera Utara
1574	ikut vaksinasi covid depok laksana puskesmas rumah sakit jumlah pusat vaksinasi massal calon	Simalungun, Sumatera Utara
1575	ikut vaksinasi covid depok laksana puskesmas jumlah pusat vaksinasi massal calon harap	Simalungun, Sumatera Utara
1576	malam pertama vaksin susah tidur lengan kiri sakit denyut denyut migrain belah kiri minum panadol sangat lapar kendali makan malam hari bangun pagi hari gerak lengan seluruh tubuh sakit lelah lelah	Singaraja, Bali
1577	info vaksin dom umm juli ots tempat umum bawa ktp fc daftar koramil	Singosari Malang, Jawa Timur
1578	kapolres situbondo tinjau stand vaksin presisi pg wringinanom camat panarukan warga sangat antusias datang masyarakat layan vaksin gratis	Situbondo, Indonesia
1579	invasi vaksin polisi negara republik indonesia tni orang orang vaksinasi booth vaksin presisi polres situbondo	Situbondo, Indonesia
1580	vaksin banyumas	Sleman,  D.I.Yogyakarta
1581	tenaga sehat banyak vaksin banyak tenaga sehat double bahkan triple work tangan pasien fasilitas sehat maupun masyarakat bagai vaksinator banyak burn out kalau mau juta per hari buka latih vaksinasi tugas sehat pantau kipi	Sleman, DIY
1582	jangan semua orang vaksinasi	Sleman, Indonesia
1583	jadi menteri netizen hancur kemudian buat vaksin sendiri kemudian henti bpom kata atur	Sleman, Indonesia
1584	beda kerumun makan kopi antri vaksin tikung perilaku sangat aneh	Soerakarta
1585	vaksin langsung selalu pakai masker hindar ramai rajin cuci tangan lawan hoax patuh atur ppkm sangat bantu kurang kasus covid	Solo
1586	bahkan vaksin sars cov mungkin lanjut depan hidup damping virus corona	Solo - Indonesia
1587	alhamdulillah vaksin sinovac selamat ibu baru sembuh minggu kemarin sibuk pimpin pasu potong kurban biasa	Solo Baru
1588	stok surabaya makin tip vaksinasi masyarakat anak anak henti	Solo, Indonesia
1589	anis matta ayo sehat ayo vaksin laksana program vaksinasi sama warga rumah masing masing rekomendasi seluruh masyarakat ikut program vaksinasi selenggara perintah	Soreang, Indonesia
1590	cepat lambat vaksin bom waktu hindar vaksinasi	South Borneo, Indonesia
1591	dunia teliti nama tingkat kesiap teknologi kalau sekarang cepat bikin vaksin teknologi siap zaman sekarang maju	South Borneo, Indonesia
1592	pertama selesai semua tahap uji klinis aku dunia misal arab saudi merek vaksin aku	South Jakarta, Indonesia
1593	antar anak anak vaksinasi gbk juli lalu antri cepat tertib	South Jakarta, Indonesia
1594	kalau alhamdulilah reaksi demam cuma perih sama kram tempat sunti ken makan terus haha tau efek pas vaksin sinovac btw perlu minum air kelapa penting sarap dulu vaksin	South Sulawesi
1595	warga singapura alami gejala ringan covid vaksin	South Sulawesi
1596	bismillah vaksin hari moga hari launching allah	South Sulawesi 
1597	bener gan susah banget buat warga camat biasa ane lucky channel dapet slot aman kota belah jogja biarpun mau ngalahin antri vaksin war jari lebih isi formulir	Special Region of Yogyakarta
1598	memang susah banget buat warga camat biasa punya salur untung slot aman kota belah jogja kalaupun kalah antri vaksin perang sendiri jari lebih isi formulir	Special Region of Yogyakarta
1599	anti vaxx lintas generasi laku hoax vaksin nikmat konspirasi covid vaksin bukti lintas generasi tua muda	Special region of Yogyakarta
1600	bantu vaksin pertama bulan juni daftar vaksin bulan juli bahkan cantum vaksin pertama	Sragen, Indonesia
1601	butuh bantu min sertifikat vaksin catat jadi sertifikat vaksin dosis pertama konfirmasi panitia vaksin benar kurang input data vaksin pertama bantu ubah min	Sragen, Indonesia
1602	banyak warga sragen surup hoax vaksin anggota dewan wakil daerah dprd minta bupati pindah camat satgas terjun	Sragen, Jawa Tengah
1603	vaksin pikir milik asam lambung sangat buruk jadi batang suntik mati konyol	Sragen, Jawa Tengah
1604	sana rawat ruang gawat darurat sempat masuk ruang awat bapak vaksin kena stroke kakak isoman rumah jadwal vaksin puskesmas sedang ibu terima vaksin corona	Subang-Ciputat-Bangkok
1605	semangat buat juang yakin orang tua vaksin jangan pernah lelah orang tua pernah lelah doa penuh butuh didik sejak kecil	Subang-Ciputat-Bangkok
